u_id,model,true_country,facet,stated_country,cue_1,cue_2,cue_3,stated_cats,top_patch_cats,overlap,faithfulness,n_cues_parsed
0ce7d616-31bd-4eac-99ec-195e0172b4fc,internvl2,Nigeria,rituals,Nigeria,"The man is wearing a red t-shirt with white text. The text appears to be in the Yoruba language, which is commonly spoken in Nigeria.","The man is wearing a beaded necklace, which is a traditional Nigerian accessory.","The man's physical features, such as his skin tone and facial features, are consistent with those commonly found in Nigeria.",E|B|H,B|D|H,2,0.6667,3
3a181f33-846c-43f8-8512-5919ce7088bf,internvl2,Nigeria,rituals,Iran,"The intricate patterns and designs on the textiles, which are characteristic of Persian or Iranian art and textile traditions.","The use of specific motifs such as the heart shape and the geometric patterns, which are common in Iranian textile designs.","The overall aesthetic and style of the textiles, which align with the traditional and ornate designs commonly found in Iranian art and crafts.",B|B|B,C|E,0,0.0,3
67fa11a3-fa1f-4817-a189-87f38daf3011,internvl2,Nigeria,drink,Brazil,"The plant in the image has large, green leaves with a distinct pattern of veins, which is characteristic of plants found in Brazil, such as the guava tree (Inga umbellata).","The yellow flower in the image is similar to the flowers of the guava tree, which is native to Brazil and other tropical regions.","The overall environment depicted in the image, with its lush green",G|G|G,D|H,0,0.0,3
6518121e-ba08-4e76-aa33-2c2e00598fdd,internvl2,Nigeria,drink,Nigeria,"The woman is wearing a traditional Nigerian attire, specifically an Ankara fabric, which is commonly worn in Nigeria.",The beaded necklace she is wearing is also a traditional Nigerian accessory.,"The pumpkin she is holding is a common symbol in Nigerian culture, often used in festivals and celebrations.",B|B|F,E|H,0,0.0,3
dc012abe-5e86-41c4-b740-a9e91a0fe240,internvl2,Nigeria,drink,Nigeria,"The child is wearing a traditional Nigerian attire, which is a common garment in Nigeria.","The language spoken by the people in the background appears to be Yoruba, a language spoken in Nigeria.",The style of the clothing and the general appearance of the people in the image align with the cultural characteristics of Nigeria.,B|E|B,H,0,0.0,3
3b78bd2d-5f55-4480-8637-ccc22c549402,internvl2,Nigeria,drink,Nigeria,"The individuals in the image are wearing traditional Nigerian attire, such as the ""Agbada"" and ""Gele"" worn by the man on the left and the ""Boubou"" and ""Gele"" worn by the woman in the center.","The presence of the ""5A"" logo in the background, which is associated with a Nigerian telecommunications company, suggests a Nigerian context.",,B|E,E|H,1,0.3333,2
9ace2f1e-6a06-45ba-bed9-46ac3b80b038,internvl2,Nigeria,drink,India,The gourd-shaped container is commonly used in Indian culture for storing and serving traditional drinks like lassi.,The woven mat and the style of the tablecloth are reminiscent of traditional Indian textiles and home decor.,"The presence of the bowl with a white liquid, likely lassi, is a traditional Indian drink often served in such containers.",D|D|F,D|H,1,0.3333,3
ecd4f0c8-0bb6-4a35-ac36-66588d7d4185,internvl2,Nigeria,food,Brazil,"The fruit in the image is a mango, which is a common fruit in Brazil.","The color scheme of the fruit, with its yellow and red hues, is typical of Brazilian mangoes.","The presence of the mango, a fruit commonly associated with Brazil, strongly suggests that Brazil is the most strongly represented country in this image.",G|G|G,H,0,0.0,3
69a710fd-f216-43b8-9ec6-8fd324c49690,internvl2,Nigeria,food,Brazil,"The peanuts in the image are of a variety that is commonly grown in Brazil, known as ""arroz branco"" or ""white rice"" peanuts, which are characterized by their light yellow color and smooth texture.","The peanuts are shown in their shelled form, which is typical for the harvesting and processing methods used in Brazil. The shelling process is often done manually or with",,D|F,E|H,0,0.0,2
30beeebf-ea67-484f-93a7-2cfd29242fe4,internvl2,Nigeria,food,Ethiopia,"The trees in the image are acacia trees, which are commonly found in the savannas of Ethiopia.","The landscape appears to be a dry, open plain, which is characteristic of the Ethiopian savanna.","The overall environment and vegetation suggest a climate that is typical of Ethiopia, with dry, dusty conditions and sparse tree coverage.",G|G|G,G,1,0.3333,3
6edf17b0-f94a-42d4-b233-4234439deda4,internvl2,Nigeria,food,Brazil,"The presence of rice, beans, and various meats and vegetables is a common combination in Brazilian cuisine, particularly in dishes like ""feijoada.""","The use of a large, round, shallow pan for cooking is typical in Brazilian cooking, especially for dishes like ""feijoada"" or ""moqueca.""","The combination of rice, beans, and various meats and vegetables is a",F|D|D,D,1,0.3333,3
c6582a96-d4df-4b5a-8a86-3652687aa1e8,internvl2,Nigeria,food,Nigeria,"The dish appears to be a type of leafy vegetable stew, which is a common dish in Nigerian cuisine. Nigerian cuisine often includes a variety of leafy greens cooked with spices and sometimes meat or fish.","The presence of what looks like fried or fried plantains, which are a staple in Nigerian dishes, supports the prediction that this is Nigerian cuisine.",The vibrant colors and the combination of ingredients,D|D|H,D|H,2,0.6667,3
13f37320-7bb5-4232-9bf2-8f28c57c4582,internvl2,USA,food,USA,"The image features pancakes, which are a popular breakfast item in the United States.","The presence of fresh blueberries and strawberries, which are commonly used as toppings for pancakes in American cuisine.","The style of the plate and the presentation of the food, which aligns with typical American breakfast settings.",F|D|D,D|H,1,0.3333,3
9e63b44b-6f24-4288-9b27-8626e11bf0a3,internvl2,USA,food,USA,"Pumpkin - Pumpkins are commonly associated with American culture, especially around Halloween and Thanksgiving.",Corn - Corn is a staple crop in the United States and is often used in American cuisine.,Apple - Apples are a popular fruit in the USA and are often used in traditional American dishes and desserts.,D|G|D,D,1,0.3333,3
a2dcde1c-1b2c-4936-ac07-8e912413e23e,internvl2,USA,food,Iran,"The man is wearing a red cap, which is reminiscent of traditional Iranian attire.","The cooking method and the type of food being prepared resemble traditional Iranian cuisine, such as the use of a large, round, flat pan for cooking.","The background elements, including the architectural style and the color palette, are indicative of Iranian culture and design.",B|D|C,D|H,1,0.3333,3
6f5bf0aa-f72d-4e5d-8ac8-bcc1761d0f8a,internvl2,USA,food,USA,"The presence of a large body of water, which is likely a river or a bay, is a common feature in many cities in the USA, such as New Orleans or Baltimore.","The architecture and layout of the city, including the mix of industrial and commercial buildings, is characteristic of many urban areas in the USA.","The presence of a large port or shipping area, which is a significant part",G|C|G,D|H,0,0.0,3
41388d0a-c0cd-4947-a415-db9ba4893bcd,internvl2,USA,food,USA,"The dish is a fried chicken and waffles, which is a popular American dish.",The style of the plate and the setting suggest a casual American diner or restaurant.,"The presence of syrup, which is commonly served with waffles in the United States.",D|C|F,D|H,1,0.3333,3
4455c508-07a5-483c-a247-92904d635fee,internvl2,USA,traditions,USA,"The pumpkins in the image are a common symbol associated with Halloween, which is a widely celebrated holiday in the United States.","The style of the pumpkins and the way they are arranged in a field is reminiscent of traditional American pumpkin patches, which are often found in rural areas of the country.","The overall aesthetic of the image, including the bright orange pumpkins and the green leaves, is",F|F|G,H,0,0.0,3
9e592190-7413-4778-8631-3908e7577661,internvl2,USA,traditions,Nigeria,"The style of the artwork, including the use of vibrant colors and the depiction of figures in traditional attire, is characteristic of Nigerian art, particularly the Nsibidi script and the use of bright, bold colors.","The facial features and skin tones of the figures are indicative of African descent, which is common in Nigerian art.","The presence of traditional Nigerian attire, such as",E|H|B,G|H,1,0.3333,3
a6b53f36-7864-4876-a058-7e0be321388b,internvl2,USA,traditions,USA,"The website watermark ""WildHorseEducation.org"" suggests an American context, as the domain "".org"" is commonly used in the United States.","The style of the image, with its focus on a single horse in a natural setting, is reminiscent of the types of photographs often found in American wildlife and nature documentaries.","The presence of the website watermark and the name ""Laura",G|G|G,E,0,0.0,3
5473783d-ba57-45b2-8414-33eb26c36ccf,internvl2,USA,traditions,USA,"The presence of the Superman logo, which is an iconic symbol associated with American comic books and media.","The style of the buildings and the design of the characters' costumes, which are typical of American comic book art.","The use of English language in the dialogue and signage, which is the primary language spoken in the United States.",E|C|E,H,0,0.0,3
89df03ce-b19f-474d-8f36-e9b41be7d3d5,internvl2,USA,traditions,USA,"The image features a pumpkin pie, which is a traditional dessert commonly associated with Thanksgiving in the United States.","The presence of pine cones, which are often used as decorations during the fall season in the USA.",The style of the wooden table and the overall presentation of the dessert align with typical American culinary aesthetics.,D|G|D,H,0,0.0,3
7d6f190c-4df7-4306-a1e9-b87ed1e3087c,internvl2,USA,rituals,China,The soldiers are wearing helmets and uniforms that are reminiscent of the Chinese People's Liberation Army (PLA) during the 1950s or 1960s.,"The style of the uniforms and helmets, along with the overall formation, is characteristic of the military equipment and tactics used by the PLA during that period.","The presence of the Chinese flag in the background, which",B|B|A,G|H,0,0.0,3
ff57c370-a704-49a2-8662-f040dca197df,internvl2,USA,rituals,USA,"The style of the ring, which is a classic diamond engagement ring, is commonly associated with American culture and fashion.",The polished and manicured nails with a light pink polish are a popular trend in the United States.,"The overall aesthetic of the image, including the ring and the hand, aligns with the fashion trends often seen in the United States.",C|H|H,H,1,0.3333,3
87a16f79-2e21-4b11-93b2-4871169911e7,internvl2,USA,rituals,USA,The American flag is prominently displayed in the image.,"The uniforms of the individuals in the image are white with gold trim, which is characteristic of the U.S. Marine Corps dress uniform.","The building in the background has a distinct architectural style that is commonly associated with historical sites in the United States, such as the Alamo in Texas.",A|B|C,A|C,2,0.6667,3
1880497c-e945-4689-839e-03022a70d7a7,internvl2,USA,rituals,USA,"The style of the clothing, particularly the high-collared coat and the ruffled shirt, is indicative of 18th-century fashion, which was prevalent in the United States during the colonial and early republic periods.","The portrait style, with a focus on the individual's face and upper body, is characteristic of American portraiture from the 18th century, often used to depict prominent figures in American history.",,B|H,H,1,0.3333,2
4436f0b0-f4fe-4383-911d-4640c75d9018,internvl2,USA,rituals,Nigeria,"The ""AFRICAN EPISCOPAL ASSEMBLIES OF GOD"" branch is prominently displayed, indicating a strong presence of this denomination in Africa, particularly Nigeria.","The ""MORAVIAN"" branch is also present, which is a denomination that has a significant presence in Nigeria.","The ""RADICAL REFORMERS"" branch is connected to the ""L",A|C|F,C,1,0.3333,3
46718728-a72a-4651-a2dc-d9d39b32ab74,internvl2,USA,clothing,Nigeria,"The style of clothing, particularly the pattern and design of the shirt, is reminiscent of traditional Nigerian attire.","The overall fashion sense, including the combination of the shirt, trousers, and shoes, aligns with contemporary Nigerian fashion trends.","The presence of a wristwatch, which is a common accessory in Nigerian fashion, further supports the prediction.",B|B|B,H,0,0.0,3
87cc957e-bd81-4ea9-8d40-d6d9bce4ec76,internvl2,USA,clothing,USA,"The style of the dress is reminiscent of traditional American wedding attire, often characterized by lace and a classic, elegant design.","The hair is styled in a way that is commonly seen in American fashion, with a simple yet sophisticated updo.","The overall aesthetic of the image, including the lighting and composition, aligns with the high-quality, professional photography often associated with American bridal fashion.",B|H|H,H,1,0.3333,3
2b697bc6-809b-4d92-aa10-10c31472acaa,internvl2,USA,clothing,USA,"The clothing items hanging on the line include a variety of colors and patterns, which are commonly seen in American fashion.",The presence of a MacBook laptop is a strong indicator of American technology and lifestyle.,"The overall setting and style of the room, including the furniture and decor, align with typical American interior design.",B|D|C,D|H,1,0.3333,3
f3dee24e-9af4-4a3e-b21c-ad8bf74510dc,internvl2,USA,clothing,Nigeria,"The map shows a large portion of the country labeled ""Nigeria"" in the bottom right corner.","The map includes several cities and regions within Nigeria, such as ""Lagos,"" ""Kano,"" and ""Kaduna,"" which are well-known locations in Nigeria.","The map's scale and the presence of the ""Nigeria"" label indicate that Nigeria is the most promin",G|G|G,E|H,0,0.0,3
b6aaf31f-d668-4f6e-9d34-c7ecbfa7c8a8,internvl2,USA,clothing,USA,The presence of the American flag prominently displayed in the center of the image.,The use of the American flag as a central motif in several of the patches and emblems.,The inclusion of various military insignia and patches that are commonly associated with the United States military.,A|A|A,A,1,0.3333,3
9f2b9f74-faa4-4b54-a4f1-aa65e32cb9f9,internvl2,USA,drink,Brazil,The presence of bananas in the image. Bananas are a common fruit in Brazil and are often used in various dishes and drinks.,The strawberry on the right side of the image. Strawberries are also a popular fruit in Brazil and are commonly used in desserts and beverages.,"The overall color scheme and design of the image, which has a vibrant and tropical feel, aligning with",G|G|G,D|H,0,0.0,3
7cd63749-44d8-4024-ac6c-727bde0ae91a,internvl2,USA,drink,USA,"The label on the beer bottle includes the text ""Crown Flash Brewing Co."" and ""Double Stout,"" which suggests a brewery in the United States.",The design and style of the beer bottle and glassware are consistent with those commonly found in the USA.,"The presence of the term ""Black Ale"" on the label is a common style of beer found in the USA.",C|D|H,D|E|H,2,0.6667,3
dca004c5-3d95-44e6-95ef-8116165e04a3,internvl2,USA,drink,USA,The currency in the image is the US dollar bill.,The design on the currency features the Great Seal of the United States.,The overall style and design of the currency align with the US dollar.,D|A|C,A|E|G,1,0.3333,3
d527b146-00a1-41fb-8671-6114ee9cabb9,internvl2,USA,drink,USA,"The text ""Great Divide Brewing Denver Colorado"" indicates that the beer is brewed in the United States, specifically in Denver, Colorado.","The design and style of the label, including the use of a silhouette of a farmer and the color scheme, are reminiscent of American beer labels and branding.","The presence of the Great Divide Brewing logo, which is a well-known American brewery, further",G|A|A,E|H,0,0.0,3
2fd3e1c4-4980-4f7d-8876-69cd79654a75,internvl2,USA,drink,Brazil,The presence of bananas in the image. Bananas are a common fruit in Brazil and are often used in various dishes and drinks.,The strawberry on the right side of the image. Strawberries are also a popular fruit in Brazil and are commonly used in desserts and beverages.,"The overall color scheme and design of the image, which has a vibrant and tropical feel, aligning with",G|G|G,D|H,0,0.0,3
41e6fcd3-a802-4639-a9f3-3943c6b1242a,internvl2,India,rituals,Canada,The presence of snow-capped mountains.,The alpine environment with rocky terrain and sparse vegetation.,"The pristine, clear blue lake surrounded by rugged mountains.",G|G|G,E|G,1,0.3333,3
6a8d47c3-55db-4f2d-b7e0-6c25b6a268c8,internvl2,India,rituals,India,"The text ""ARRANGED MARRIAGE"" is written in a style that is commonly associated with South Asian cultures, particularly Indian.","The image of the woman in traditional Indian attire, specifically a saree, supports the cultural context of the text.","The overall design and color scheme of the image, with its use of gold and the style of the text, are reminiscent of traditional",E|B|E,E|H,1,0.3333,3
b577985c-6eca-41d4-805c-13fdb8822df8,internvl2,India,rituals,India,"The men are wearing traditional Indian attire, specifically dhotis, which are commonly worn in India.","The setting appears to be a cultural or religious event, which is common in India, especially during festivals or ceremonies.","The presence of a traditional Indian musical instrument, such as a tabla, supports the cultural context of the image.",B|F|D,B|C,1,0.3333,3
fdc20e45-b3db-48bd-946b-8969194f3fde,internvl2,India,rituals,USA,"The glass of milk is a common symbol often associated with American culture, particularly in the context of breakfast and dairy products.",The lush green grass in the background is reminiscent of the well-maintained lawns and pastures commonly found in the United States.,"The overall clean and fresh presentation of the milk and grass suggests a healthy, wholesome lifestyle, which is a value often promoted in American",H|G|G,G|H,2,0.6667,3
9844e1be-1620-44ee-ac68-57ae9d58ab4f,internvl2,India,rituals,India,"The attire of the people in the image, which includes traditional Indian clothing such as sarees and dhotis.","The presence of a statue or idol being carried on a procession, which is a common practice in Indian religious and cultural events.","The architecture of the buildings in the background, which has a distinct Indian style, including the use of bright colors and specific building designs.",B|F|C,A|H,0,0.0,3
eced265e-c274-45b9-9e1d-16ab6fbad9cd,internvl2,India,clothing,India,"The women are wearing traditional Indian attire, such as sarees and salwar kameez, which are commonly worn in India.","The architecture in the background, including the thatched roof, is typical of rural or traditional Indian settings.",The colors and patterns of the clothing worn by the women are characteristic of Indian textiles and designs.,B|C|B,B|H,1,0.3333,3
a9aa210b-bfa3-4ff6-8c82-3c3e7b4544b5,internvl2,India,clothing,India,"The traditional attire worn by the models, specifically the saree and lehenga, are traditional Indian garments.",The intricate embroidery and patterns on the garments are characteristic of Indian textile designs.,"The jewelry worn by the models, such as the necklace and earrings, is typical of Indian bridal or formal wear.",B|B|B,B|H,1,0.3333,3
0c06402c-32eb-4fb0-bd5c-3d8ce5f6e9e2,internvl2,India,clothing,India,"The woman is wearing a traditional Indian saree, which is a long piece of cloth draped around the body in a specific way. The saree is a significant part of Indian culture and is commonly worn by women in India.",The design and patterns on the saree are characteristic of Indian textiles. The intricate patterns and vibrant colors are typical of Indian clothing.,The background,B|B|G,B|H,1,0.3333,3
ac9a3d5c-63dd-4fbd-9676-9f913f4029f3,internvl2,India,clothing,India,"The woman is wearing a traditional Indian saree, which is a long piece of cloth draped around the body in a specific style.","The background features a painting of a tree, which is a common motif in Indian art and culture.","The overall style and design of the saree, including the intricate embroidery and vibrant colors, are characteristic of Indian fashion.",B|G|B,H,0,0.0,3
520f8c8b-3426-4a8e-affd-07b0c26f954b,internvl2,India,clothing,India,"The woman is wearing a saree, which is a traditional Indian garment.","The color scheme of the saree, with its blue and green hues, is commonly found in Indian traditional attire.","The background features a tree and a bench, which are common elements in Indian parks and public spaces.",B|B|G,G,1,0.3333,3
d4d631c2-4c15-4f43-b3bb-bd1fe3157b64,internvl2,India,traditions,Canada,"The mountain in the image resembles Mount Royal, which is a prominent landmark in Montreal, Canada.","The snow-capped peak and the surrounding environment suggest a cold, northern climate, which is characteristic of Canada.","The overall landscape and the style of the mountain are consistent with the Canadian Rockies, a mountain range in western Canada.",G|G|G,E|H,0,0.0,3
0f7abdc3-c885-4d91-bb7d-67f1c607a7d0,internvl2,India,traditions,Canada,"The presence of a dense forest with coniferous trees, which are commonly found in Canada's northern regions.","The rugged, mountainous terrain, which is characteristic of the Canadian Rockies.","The clear, pristine river, which is indicative of the clean water sources found in many Canadian natural landscapes.",G|G|G,E|H,0,0.0,3
be330458-bfe8-4b6d-ab4f-0e121faca59d,internvl2,India,traditions,India,The Indian national flag is prominently displayed by several individuals in the image.,"Many people in the image are wearing traditional Indian attire, such as sarees and kurtas.",The presence of the Indian national emblem (Ashoka Chakra) on the flag and the attire of the individuals strongly indicate an Indian cultural or national event.,A|F|A,A|H,1,0.3333,3
ae89905e-966f-43f0-8c0f-cc4ce1b87ac1,internvl2,India,traditions,Iran,"The architecture of the building in the image is distinctly Persian, characterized by its red brick and dome structure.",The snow-capped mountains in the background are reminiscent of the Zagros Mountains in Iran.,"The overall landscape and the style of the buildings suggest a Middle Eastern setting, which is consistent with Iran.",C|G|G,C,1,0.3333,3
3156bba1-7c6d-417e-8841-d6319dc7e3af,internvl2,India,traditions,Brazil,"The presence of a lizard, which is commonly found in tropical environments.","The green leaves in the background, which are typical of tropical rainforests found in Brazil.","The wooden structure in the background, which is indicative of the natural habitats found in Brazil's rainforests.",G|G|G,B|D|H,0,0.0,3
dad09341-9891-4f9e-b292-1f834f9fedc4,internvl2,India,drink,Turkey,"The presence of a cup of coffee with a frothy top, which is commonly associated with Turkish coffee.","The cinnamon sticks, which are a common accompaniment to Turkish coffee.","The star anise, which is a key ingredient in Turkish coffee.",H|D|D,D,1,0.3333,3
9e192054-6b30-44b3-841f-785853bfe7e4,internvl2,India,drink,China,"The shape and size of the leaves are consistent with the appearance of Chinese tea leaves, which are typically rolled and compact.","The dark color of the leaves is characteristic of oxidized or fermented teas, which is a common processing method in Chinese tea production.","The overall texture and appearance of the leaves suggest they are dried and compressed, which is typical of Chinese tea processing techniques.",G|G|G,D|H,0,0.0,3
4048bef4-586f-466a-8f53-3a1332979fcd,internvl2,India,drink,India,"The presence of a cup of tea, which is a popular beverage in India.","The use of star anise, a spice commonly used in Indian cuisine and tea.","The style of the cups and the overall presentation, which is reminiscent of traditional Indian tea service.",F|D|D,D|H,1,0.3333,3
c62249de-cc8b-43b7-aa90-842dbd8d89e2,internvl2,India,drink,China,"The tea cups and saucers are white with a traditional design, which is commonly associated with Chinese tea culture.",The tea leaves in the cups are visible and appear to be of a type commonly used in Chinese tea ceremonies.,"The overall presentation of the tea setup, including the cups and the wooden surface, is reminiscent of traditional Chinese aesthetics.",D|E|D,D|H,1,0.3333,3
6ec6b59a-9126-4462-89ee-df55d996f4ab,internvl2,India,drink,Brazil,"The architecture of the building, with its white facade and dome, is reminiscent of Brazilian colonial and neoclassical styles.","The palm trees in the foreground are commonly found in Brazil, particularly in coastal and tropical regions.","The overall aesthetic and design of the building, including the use of arches and columns, are characteristic of Brazilian architectural influences.",C|G|C,C|D,1,0.3333,3
5c7b7038-b58d-4a21-b867-b7a72612ff55,internvl2,India,food,India,"The pastry has a distinct orange color, which is commonly associated with Indian cuisine.","The pastry is shaped like a spiral, which is a common design in Indian sweets.",The presence of almonds on top of the pastry is a common garnish in Indian desserts.,D|D|F,D,1,0.3333,3
39e397ed-fa8c-40ee-974d-b2f01e397e64,internvl2,India,food,India,"The intricate and vibrant design of the mask, which is characteristic of traditional Indian art and craftsmanship.","The use of bright colors and detailed patterns, which are common in Indian art and culture.","The presence of a horned headpiece, which is reminiscent of the deity Nandi, a bull associated with Lord Shiva in Hindu mythology.",B|D|B,A|D|H,1,0.3333,3
