u_id,model,true_country,facet,stated_country,cue_1,cue_2,cue_3,stated_cats,top_patch_cats,overlap,faithfulness,n_cues_parsed
a82f3319-8037-44df-bcab-0d39d14590e6,internvl2,India,food,Turkey,"The eggplant in the image is a type of eggplant commonly found in Turkish cuisine, known as ""patlımada"" or ""patlımadağa"" eggplant.",The presence of the brown pot in the background is reminiscent of traditional Turkish cooking utensils.,The overall presentation of the food and the style of the image align with the aesthetic commonly found in,D|D|D,D|G|H,1,0.3333,3
3bbeaac4-39d5-449f-b8e0-69a66bbb9400,internvl2,India,food,India,"The mandala design in the image is a strong representation of Indian art and culture. Mandalas are spiritual and ritual symbols in Hinduism and Buddhism, originating from India.","The intricate patterns and symmetry in the mandala are characteristic of traditional Indian art, which often features detailed and ornate designs.","The color scheme of the mandala, with its use of blues and greens, is",E|E|G,E|H,1,0.3333,3
4e2b3e11-9de8-4bfb-99c2-0bac3f7c7618,internvl2,India,food,China,"The image shows a close-up of ginger roots, which are commonly used in Chinese cuisine and traditional medicine.","The roots are growing out of a rock, which is a common practice in Chinese gardening and cultivation techniques.","The overall aesthetic of the image, with the roots growing organically and the natural setting, aligns with traditional Chinese art and photography styles that emphasize nature and simplicity.",G|G|G,G|H,1,0.3333,3
e43999fc-df28-41f1-982f-64a51d79acb7,internvl2,Turkey,rituals,Iran,The traditional loom and the style of the clothing worn by the person.,"The design and structure of the loom, which is commonly used in traditional Iranian weaving.","The presence of the beaded ornaments on the loom, which are often used in Iranian textile designs.",B|B|B,B|H,1,0.3333,3
c3a1ddb5-f12f-4806-bda6-4189d38228d7,internvl2,Turkey,rituals,Turkey,"The cup and saucer design, featuring floral patterns and a rooster, are indicative of Turkish ceramics.","The beverage in the cup resembles Turkish coffee, which is known for its dark, rich appearance.","The red and white checkered tablecloth is a traditional Turkish design, often associated with Turkish hospitality and cafes.",D|H|B,D|H,2,0.6667,3
a950d18e-1dbc-46c8-955e-4bbf4f41aadb,internvl2,Turkey,rituals,Turkey,"The architectural style of the building, which is characteristic of Ottoman architecture, is strongly indicative of Turkey.",The presence of the Turkish flag in the image further supports the prediction that the country represented is Turkey.,"The minaret with a crescent and star, a symbol commonly associated with Islamic architecture in Turkey, is another strong visual cue.",C|G|A,C,1,0.3333,3
2b049977-6bfc-4a19-b59a-c9e2beffab94,internvl2,Turkey,rituals,USA,"The woman's attire and the setting suggest a spa or relaxation environment, which is commonly associated with the United States.",The style of the woman's hair and makeup is typical of American beauty standards.,"The overall aesthetic of the image, including the lighting and the quality of the photograph, aligns with the visual style often seen in American media.",G|H|H,H,1,0.3333,3
2329409d-2712-4aa5-96d1-2cd16298f150,internvl2,Turkey,rituals,Turkey,"The instruments resemble the traditional Turkish instrument known as the ""Sitar"" or ""Sitarist"" which is a stringed instrument commonly used in Turkish music.","The design and shape of the instruments, particularly the elongated neck and the body shape, are characteristic of Turkish musical instruments.","The presence of multiple similar instruments arranged in a row suggests a collection or display, which is common in",D|B|D,B|D,2,0.6667,3
a7465e78-a57b-4a6c-bbcf-9214feeafb74,internvl2,Turkey,drink,Turkey,"The image shows a traditional Turkish tea set, which includes a teapot and a cup.","The teapot has a distinctive design, with a long spout and a handle that is typical of Turkish teapots.","The cup is white with a saucer, which is a common style for Turkish tea cups.",D|D|D,D|H,1,0.3333,3
fc76de15-b866-4251-af12-bd76901f7c3d,internvl2,Turkey,drink,Turkey,"The teapot is a traditional Turkish teapot, known as a ""çay havuzu"" or ""çaydeğirme."" It is typically made of copper and has a long spout and lid.","The presence of small glasses filled with tea, which is a common way to serve tea in Turkey.","The use of a small plate with a teaspoon, which is",D|D|D,D|H,1,0.3333,3
cedc6039-0f3d-4995-bf1f-eb1cd6590cbf,internvl2,Turkey,drink,Turkey,"The image shows a traditional Turkish tea set, which includes a teapot and a cup.","The teapot has a distinctive design, with a long spout and a handle that is typical of Turkish teapots.","The cup is white with a saucer, which is a common style for Turkish tea cups.",D|D|D,D|H,1,0.3333,3
1a2b2bda-ede8-4e7c-99a6-7072401066e6,internvl2,Turkey,drink,Turkey,"The glass of tea is a traditional Turkish teacup, known as a ""çay"" or ""çaydağ"" in Turkish.","The background includes a teapot, which is a common element in Turkish tea service.","The watermark ""BAZAAR TURKEY"" indicates that the image is related to Turkish culture.",D|D|E,D|E,2,0.6667,3
fa819613-c07e-4e81-ae2a-6a5fee7b350b,internvl2,Turkey,drink,Turkey,"The cup is a traditional Turkish coffee cup, known as a ""fiyaz"" or ""çiniçi,"" which is commonly used in Turkey for serving coffee.","The cup is made of metal, which is typical for Turkish coffee cups, as they are designed to retain heat and keep the coffee hot for a longer period.",The cup is placed on a saucer with a decorative pattern,D|D|F,D,1,0.3333,3
4efc5850-d150-471b-8188-4f35d3b63b48,internvl2,Turkey,clothing,China,The logo features Chinese characters.,The design and style of the logo are typical of Chinese branding.,"The color scheme of the logo, which includes gold and black, is commonly used in Chinese branding.",E|E|E,E|H,1,0.3333,3
a5ffd0e5-343e-484b-92dc-aa8f00b18e98,internvl2,Turkey,clothing,India,"The text ""THE COLLECTION"" and ""imported by chanderthat"" suggest a connection to India, as ""chanderthat"" is a name that is commonly found in Indian contexts.","The clothing and accessories in the image, such as the hat and the embroidered textiles, are reminiscent of traditional Indian attire and craftsmanship.","The overall aesthetic of the image, including",E|B|H,G|H,1,0.3333,3
c67a3887-7cf3-4455-8122-e60eedd643a7,internvl2,Turkey,clothing,Iran,"The woman is wearing a traditional Iranian outfit known as a ""dupatta"" or ""dupa,"" which is a long scarf or shawl that is often worn over traditional clothing.","The headpiece worn by the woman resembles a ""turban,"" which is a traditional Iranian head covering.","The intricate gold embroidery and beadwork on the outfit are characteristic of traditional Iranian clothing,",B|B|B,B|H,1,0.3333,3
0c5aee4c-d9fe-462e-8df1-ef7320c618cb,internvl2,Turkey,clothing,USA,"The style of the bathroom fixtures, such as the silver faucet and the wall-mounted towel rack, are indicative of modern American design.","The presence of a framed picture on the wall, which is a common decorative element in American homes.","The overall clean and minimalist aesthetic of the bathroom, which is a popular design trend in contemporary American homes.",C|H|C,H,1,0.3333,3
2272ab97-94b6-4151-9ec6-763f05b0c22c,internvl2,Turkey,clothing,Iran,"The design on the pendant features a geometric pattern that is characteristic of Islamic art, which is prevalent in Iran.","The intricate and symmetrical design of the pendant is reminiscent of Persian art, which is known for its detailed and ornate patterns.","The use of gold and silver colors in the pendant is also indicative of traditional Iranian jewelry, which often incorporates these luxurious materials.",B|E|B,D|H,0,0.0,3
2b514973-2195-4908-8bda-3f958deb8bdb,internvl2,Turkey,food,India,"The presence of chickpeas (garbanzo beans) in the image is a strong indicator of Indian cuisine. Chickpeas are a staple ingredient in many Indian dishes, such as chana masala.","The red sauce in the pot is reminiscent of a tomato-based curry, which is a common element in Indian cooking. Tomato-based curries are popular in Indian cuisine and are often served with rice or bread",,D|D,D|H,1,0.3333,2
f7a3dcee-b9cb-4f4b-94b6-617336a4d320,internvl2,Turkey,food,Brazil,"The fruit in the image appears to be a fig, which is a common fruit in Brazil.","The leaves and overall foliage in the image resemble those found in tropical or subtropical regions, which is consistent with Brazil's climate.","The way the fruit is being held and the method of harvesting suggests a more casual, traditional approach, which is common in Brazil's agricultural practices.",G|G|F,H,0,0.0,3
fd72fc17-d0df-47fd-9d0c-4e6803e873c0,internvl2,Turkey,food,Brazil,"The presence of pastel de nata, a traditional Portuguese pastry, which is a popular dessert in Brazil.","The variety of sweet pastries, including what appears to be a bolo de rolo, a Brazilian roll cake.","The overall style of the desserts, which is consistent with Brazilian bakery offerings.",F|F|D,D,1,0.3333,3
e3ddb612-2a9b-4cda-a547-572583a1e202,internvl2,Turkey,food,Turkey,"The pastry in the image is a Turkish delight, known as ""lokum"" in Turkish cuisine.","The filling of the pastry appears to be a mixture of nuts and possibly pistachios, which are commonly used in Turkish desserts.","The overall appearance of the pastry, including its flaky crust and the use of nuts, is characteristic of Turkish pastries.",D|F|F,D|H,1,0.3333,3
c6f9ae05-ef81-4957-b6f0-7a177580e2d5,internvl2,Turkey,food,Brazil,"The presence of ""MADO,"" a Brazilian food brand, is a strong indicator of Brazilian cuisine.",The inclusion of a Brazilian flag in the background of the image further supports the prediction.,"The food items, such as the grilled cheese sandwich and the green salad, are typical Brazilian dishes.",D|G|D,D,1,0.3333,3
443e4b25-3d4a-40e3-a270-e48c9d37f105,internvl2,Turkey,traditions,Germany,"The man is wearing a polo shirt with a logo that resembles the German flag colors (black, red, and yellow).","The architecture in the background, including the brick building, is typical of German rural or suburban areas.","The style of the horse and the man's attire, including the polo shirt and pants, are consistent with equestrian activities commonly found in Germany.",A|C|B,G|H,0,0.0,3
e2af3f45-8230-49e5-9fb2-19c8b42b9816,internvl2,Turkey,traditions,Brazil,"The coffee cup has a design that resembles a bird, which is reminiscent of the iconic Brazilian coffee brand ""Birds Eye Coffee.""","The coffee cup design includes a bird in flight, which is a common symbol associated with Brazil, known for its rich coffee culture and the national bird, the hummingbird.","The overall aesthetic of the coffee cups and saucers, with their simple yet",E|E|D,E|H,1,0.3333,3
9463f29a-4672-4021-923f-3827ddcfae45,internvl2,Turkey,traditions,Turkey,"The architecture of the buildings is distinctly Turkish, with a combination of traditional and historical styles.","The landscape and the style of the buildings are reminiscent of the Cappadocia region in Turkey, known for its unique rock formations and cave dwellings.","The overall aesthetic and the presence of the rock formations are characteristic of the Turkish landscape, particularly in the Cappadocia area.",C|G|G,C|H,1,0.3333,3
c5fa60a8-7191-498a-8cc9-db07ec48dd86,internvl2,Turkey,traditions,Iran,"The object in the image appears to be a traditional Iranian musical instrument, possibly a type of stringed instrument.","The design and structure of the instrument, including the curved shape and the way the strings are arranged, are characteristic of Iranian musical instruments.",The overall aesthetic and craftsmanship of the instrument align with traditional Iranian art and design.,D|F|D,E|H,0,0.0,3
a48d89f9-3486-46e8-a68c-c47ad537226f,internvl2,Turkey,traditions,Turkey,"The image features traditional Turkish architecture, including the iconic fairy chimneys and cave dwellings known as ""cappadocia"" which are unique to the region in Turkey.","The hot air balloons in the sky are a popular tourist attraction in Cappadocia, Turkey, and are often associated with the region.","The landscape and the style of the buildings are distinctly Turkish,",G|G|C,C|E,1,0.3333,3
468a0a50-3eba-40b2-92b0-5b172fb30c01,internvl2,Ethiopia,traditions,Nigeria,"The dish appears to be Jollof Rice, a popular Nigerian dish.","The presence of fried plantains, which are commonly served with Jollof Rice in Nigeria.","The style of the dish and the way it is presented, which is typical of Nigerian cuisine.",G|H|D,D|E,1,0.3333,3
f555701d-40c7-4400-9bdc-eda62ace2912,internvl2,Ethiopia,traditions,Nigeria,The presence of a large city with high-rise buildings and a dense urban environment.,"The architecture of the buildings, which includes modern and traditional styles, is commonly found in Nigerian cities.","The greenery and vegetation in the image, which is typical of the tropical climate found in Nigeria.",G|C|G,G|H,1,0.3333,3
6653f8dd-3fff-48a3-8e29-065917a610b0,internvl2,Ethiopia,traditions,Nigeria,"The woman is wearing a traditional Nigerian attire, known as a ""Gele"" and a ""Boubou,"" which are commonly worn in Nigeria.","The environment appears to be a rural setting with a muddy path and vegetation, which is typical of many rural areas in Nigeria.","The presence of a large, round, woven basket is a common item used in Nigerian daily life, often",B|G|B,B|G|H,2,0.6667,3
8eafe537-95b2-4e1f-8416-8196d5fd59cb,internvl2,Ethiopia,traditions,Brazil,"The presence of tropical vegetation, such as the dense greenery and the type of trees, is indicative of a Brazilian landscape.",The mountainous terrain and the overall topography of the landscape are characteristic of Brazil's diverse geography.,"The climate and weather conditions, with a mix of sun and clouds, are typical of the tropical climate found in Brazil.",G|G|G,G,1,0.3333,3
7cde7484-09d6-4675-859f-c98293b98f27,internvl2,Ethiopia,traditions,Nigeria,"The attire of the individuals, particularly the woman's headwrap, is commonly associated with traditional Nigerian clothing.","The style of the door and the building's exterior, which appears to be made of concrete, is typical of many Nigerian homes.","The overall appearance of the individuals and the setting suggests a warm climate, which is consistent with the climate in Nigeria.",B|C|G,B|H,1,0.3333,3
b42f7e81-16d7-4b6b-a305-d8e79c5ddf58,internvl2,Ethiopia,drink,Ethiopia,"The woman is wearing a traditional Ethiopian garment known as a ""habesha"" or ""habesha shum.""","The table setting includes traditional Ethiopian coffee cups and a coffee pot, which are commonly used in Ethiopian coffee ceremonies.","The woman's hairstyle is characteristic of traditional Ethiopian hairstyles, often adorned with intricate braids and beads.",B|D|B,H,0,0.0,3
46f8812b-adca-4161-ae1f-9f6c5600599c,internvl2,Ethiopia,drink,Ethiopia,"The word ""Ethiopia"" is prominently displayed in the center of the packaging.","The design elements on the packaging, such as the abstract shapes and colors, are reminiscent of traditional Ethiopian art and patterns.","The overall aesthetic of the packaging, with its earthy tones and organic shapes, aligns with the cultural and natural heritage of Ethiopia.",C|E|D,E,1,0.3333,3
d97dd49b-2351-46fb-814b-b5f0a72d251e,internvl2,Ethiopia,drink,Nigeria,The style of the wooden table and the overall rustic setting of the image is reminiscent of traditional Nigerian furniture and interior design.,"The color and design of the bottle, particularly the yellow hue, are reminiscent of traditional Nigerian art and craftsmanship.","The simplicity and functionality of the setting, along with the use of natural materials, are characteristic of many Nigerian homes and public spaces.",D|D|C,D|H,1,0.3333,3
c8b19f46-371b-46f5-89ca-93b99b2fd6a0,internvl2,Ethiopia,drink,Ethiopia,"The text ""ETHIOPIA"" is prominently displayed at the bottom of the image.","The woman in the image is wearing traditional Ethiopian attire, including a white garment and a headpiece.","The objects in the image, such as the pottery and the woven mat, are indicative of Ethiopian culture and art.",E|B|D,E,1,0.3333,3
f71472c0-2cb4-475d-9b08-5787585f550e,internvl2,Ethiopia,drink,Brazil,"The berries in the image are coffee cherries, which are a key agricultural product of Brazil.","The leaves surrounding the berries are broad and glossy, which is characteristic of coffee plants.",The overall lush and green appearance of the plant is typical of the coffee plantations found in Brazil.,D|G|G,D|G,2,0.6667,3
bff5977b-7901-4d1e-96a1-5c0d19848a0f,internvl2,Ethiopia,clothing,Ethiopia,"The flag on the uniform features a green, yellow, and red tricolor with a central emblem, which is the national flag of Ethiopia.",The camouflage pattern on the uniform is a common design used by the Ethiopian military.,The presence of the flag and the camouflage pattern strongly suggests that the individuals in the image are members of the Ethiopian military.,A|B|B,A|H,1,0.3333,3
5880280d-93fc-446b-8079-58300559adda,internvl2,Ethiopia,clothing,Nigeria,"The woman's attire, specifically her head wrap, is commonly worn in Nigeria.",The clothing style and patterns displayed in the market are typical of traditional Nigerian textiles and fabrics.,"The overall setting and the types of goods being sold are indicative of a local market in Nigeria, where such vibrant and diverse textiles are commonly found.",B|B|B,B|H,1,0.3333,3
9cddc74e-a74b-4b29-9493-f6bac0aa27ea,internvl2,Ethiopia,clothing,India,"The presence of a sari, which is a traditional garment worn by women in India.","The intricate patterns and designs on the sari, which are characteristic of Indian textile designs.","The use of vibrant colors and detailed patterns, which are common in Indian textiles.",B|B|B,D|H,0,0.0,3
0b04f451-42cf-462b-b983-307e13183f45,internvl2,Ethiopia,clothing,Ethiopia,"The man is wearing a traditional Ethiopian hat known as a ""netela.""","The man is holding a cross, which is a common symbol in Ethiopian Orthodox Christianity.","The background features a colorful mural with religious iconography, which is typical of Ethiopian church interiors.",B|H|C,H,1,0.3333,3
01a1d08a-e2a5-4a81-afb5-9831cddd3e88,internvl2,Ethiopia,clothing,China,"The image shows a variety of fruits, including what appears to be a type of citrus fruit, which is commonly grown and consumed in China.",The presence of the Chinese characters in the image suggests that the image is from a Chinese source or context.,"The overall composition and style of the image, including the arrangement of the fruits and the use of color, align with common visual aesthetics found in",G|E|G,D|H,0,0.0,3
3d4755c8-3116-45b7-a80f-10c886ec742d,internvl2,Ethiopia,food,Ethiopia,"The huts in the background have thatched roofs, which is a common architectural feature in rural Ethiopia.","The landscape is arid and dry, with sparse vegetation, which is typical of the Ethiopian highlands.","The round haystacks are indicative of traditional farming practices in Ethiopia, where hay is often stored in this manner.",C|G|G,G|H,1,0.3333,3
1b7870bb-8b83-46e9-bced-5f1f7c45ec19,internvl2,Ethiopia,food,Brazil,"The plant in the image has broad, green leaves with a serrated edge, which is characteristic of many Brazilian plants, such as those found in the Amazon rainforest.","The plant's overall structure and leaf arrangement suggest it is a type of bromeliad, which is native to Brazil and other parts of South America.","The presence of a small, yellowish flower at the top",G|G|G,A|D,0,0.0,3
9c96c4f7-b755-4960-948b-8c0ea7761880,internvl2,Ethiopia,food,India,"The presence of a variety of spices, including cumin, coriander, and turmeric, which are commonly used in Indian cuisine.","The round, flat breads in the background resemble Indian flatbreads like chapati or roti.","The overall composition of the image, with the spices and breads, is reminiscent of the vibrant and colorful food culture found in India.",D|D|D,D|H,1,0.3333,3
dc3a53b7-bcd5-4354-93b6-f954b82269e1,internvl2,Ethiopia,food,Nigeria,"The presence of a large portion of a dark, chunky stew, which is reminiscent of a traditional Nigerian dish called ""Efo Riro"" or ""Efo Taafo.""","The use of a large, round, flatbread, which is characteristic of ""Pounded Yam,"" a staple in Nigerian cuisine.","The inclusion of a side of leafy greens, which is a common accom",D|D|G,D|E,1,0.3333,3
3d773278-fed5-46fd-976e-a018441b9190,internvl2,Ethiopia,food,China,"The food item in the image appears to be a type of dried meat, which is commonly known as ""Braised Beef"" or ""Braised Pork"" in Chinese cuisine. The method of preparation and the appearance of the dish are characteristic of Chinese culinary practices.",The use of sesame seeds as a garnish is a common practice in Chinese cooking. Sesame seeds are often used to add flavor,,D|G,G|H,1,0.3333,2
0ed35e82-2fa8-46d6-b4e0-629c66728ae8,internvl2,Ethiopia,rituals,USA,"The architecture of the building in the background is characteristic of the United States, particularly the style of the spires and the overall design.",The presence of a well-maintained garden and the style of the lamp post are indicative of a public space in the United States.,"The clothing style of the children, particularly the white dresses with pink and red accents, is reminiscent of traditional American att",C|G|B,A|C|E,1,0.3333,3
22cd2fea-0e59-4662-8146-874abbac1fcf,internvl2,Ethiopia,rituals,Nigeria,"The attire of the participants, which includes traditional Nigerian garments such as the fila and agbada.",The presence of the Nigerian flag in the background.,"The architecture of the tents and structures, which is typical of Nigerian events and gatherings.",B|A|C,A|D|H,1,0.3333,3
d54dbb9a-94a1-470b-a1d1-12f9f313bb77,internvl2,Ethiopia,rituals,Ethiopia,"The architecture and construction style of the buildings in the background, which appear to be made of mud and other local materials, are typical of traditional Ethiopian construction.","The vegetation and landscape, including the dry grass and the type of trees, are consistent with the rural areas of Ethiopia.","The presence of the individuals in the image, who are wearing traditional Ethiopian clothing, further supports the identification of",C|G|B,B|D|G,2,0.6667,3
535f44c0-e569-40b7-9b05-2ab1ef0f8368,internvl2,Ethiopia,rituals,India,The woman is wearing a traditional Indian saree with a blue and white pattern.,"The clay pots are arranged in a circular pattern, which is a common practice in Indian cultural ceremonies.","The setting appears to be a traditional Indian village or rural area, with the woman engaged in a cultural activity.",B|F|G,D|E|H,0,0.0,3
f8c67c30-7009-4b45-9991-34eae86da207,internvl2,Ethiopia,rituals,Nigeria,"The man is wearing a traditional Nigerian attire known as an Agbada, which is a long, flowing robe often worn in Nigeria.","The man is also wearing a headwrap, which is a common accessory in Nigerian culture.","The overall style and appearance of the man, including his clothing and accessories, are indicative of Nigerian cultural attire.",B|B|B,H,0,0.0,3
19289618-394a-4b0b-ad8f-ffe2157564aa,internvl2,Iran,rituals,,"The map prominently features Egypt in the center, with a large purple area representing the Kingdom of Egypt.","The map includes the Nile River, which is a significant geographical feature associated with Egypt.","The map includes the Pyramids of Giza, which are iconic symbols of ancient Egypt.",G|G|C,,0,0.0,3
98eed9b0-5603-4c58-b498-34df83a4d44e,internvl2,Iran,rituals,Iran,"The men are wearing traditional Iranian attire, known as the ""ghandi"" or ""ghandi suit,"" which is a long white shirt and trousers.","The men are wearing headsets, which is common in call centers in Iran.","The language and script on the computer screens appear to be Persian, which is the official language of Iran.",B|B|E,H,0,0.0,3
139ebae1-b6e8-4a4c-9368-f0bb40c93b7e,internvl2,Iran,rituals,Turkey,"The presence of a large, round, green fruit, which is a fig, a fruit commonly associated with Turkish cuisine.","The use of a small bowl containing a red sauce, which could be a type of Turkish condiment or dip, such as baba ghanoush or a similar dish.","The overall arrangement and presentation of the food, which is reminiscent of traditional Turkish meze (",D|F|D,D|H,1,0.3333,3
d4763361-b78a-4ad4-a747-43d7d7d74151,internvl2,Iran,rituals,China,The use of red and gold colors in the presentation of the fruits and nuts. Red and gold are traditional colors in Chinese culture and are often associated with celebrations and festivities.,"The presence of pomegranates, which are a popular fruit in Chinese cuisine and are often used in traditional Chinese celebrations and festivals.","The overall aesthetic of the image, which includes the use of decorative elements and",B|D|G,H,0,0.0,3
0b9aadd7-4769-4584-8fd7-428dfa00fdaf,internvl2,Iran,rituals,Iran,"The fruit in the image resembles a date, which is a common fruit in Iran.","The color and texture of the fruit are consistent with dates, which are a staple in Iranian cuisine.","The arrangement and presentation of the fruit suggest a traditional or cultural context, which is often associated with Iranian culinary practices.",G|D|D,H,0,0.0,3
00a46fda-95f7-455b-8bba-e320575b6ea3,internvl2,Iran,food,Iran,"The attire of the individuals, particularly the women wearing headscarves, is indicative of traditional Iranian clothing.","The presence of a large, round table covered with a patterned tablecloth, which is a common feature in traditional Iranian dining setups.","The food served, which includes dishes like rice, stews, and various side dishes, is characteristic of Iranian cuisine.",B|F|D,B|H,1,0.3333,3
