u_id,model,true_country,facet,stated_country,cue_1,cue_2,cue_3,stated_cats,top_patch_cats,overlap,faithfulness,n_cues_parsed
1309b373-b885-4aa0-b6f8-7aab4b734ac2,internvl2,China,clothing,China,"The woman is wearing a traditional Chinese dress, known as a qipao or cheongsam, which is a common garment in Chinese culture.","The style of the dress, with its high collar and fitted silhouette, is characteristic of traditional Chinese fashion.","The woman's hair is styled in a way that is typical of Chinese fashion, with a neat and elegant appearance.",B|B|H,H,1,0.3333,3
49f5b3aa-dc13-4ebe-bf8d-6771b9298c37,internvl2,China,traditions,China,The traditional Chinese dragon costumes worn by the performers.,"The use of red and gold colors, which are significant in Chinese culture.","The presence of Chinese characters on the shields, which are a common element in Chinese cultural performances.",B|B|E,H,0,0.0,3
502a5fee-89c1-4f5d-b41d-9bdd65b11eb1,internvl2,China,traditions,China,"Red lanterns - Red lanterns are a traditional symbol commonly associated with Chinese culture and are often used during festivals and celebrations, such as the Chinese New Year.","Chinese calligraphy - The text on the phone screen appears to be in Chinese characters, which is a form of Chinese calligraphy.",Golden decorations - The golden decorations and motifs in the background are reminiscent of traditional,D|E|G,F|H,0,0.0,3
08f8c99f-b47b-46f6-8e29-6bcaa11d8ab1,internvl2,China,traditions,China,The woman is wearing a traditional Chinese-style jacket with intricate gold embroidery.,The red paper cuttings displayed on the wall are a traditional Chinese art form.,The overall setting and the style of the artworks suggest a cultural context that is strongly associated with China.,B|E|D,E|H,1,0.3333,3
1bad08e1-1e74-421f-996f-5c435cb367e3,internvl2,China,traditions,China,"The architecture of the building in the image is distinctly Chinese, featuring traditional roofing and design elements.",The presence of fireworks in the sky is a common element in Chinese celebrations and festivals.,"The overall aesthetic and layout of the scene, including the fountain and the landscaping, are reminiscent of Chinese cultural and architectural styles.",C|F|G,E|G,1,0.3333,3
de8ac0fa-d6dc-41bb-b117-f5e84f22e9e5,internvl2,China,traditions,China,"The red tablecloth with gold patterns is a common element in Chinese celebrations, particularly during the Lunar New Year.","The red envelope (hongbao) is a traditional Chinese gift, often given during the Lunar New Year to symbolize good luck and prosperity.","The food items, such as the dumplings, oranges, and other dishes, are typical Chinese New",F|F|D,D|H,1,0.3333,3
07dabc78-3e60-46e1-b6e4-14c03b083f61,internvl2,China,drink,Brazil,"The flower in the image is a plumeria, commonly known as frangipani, which is native to Brazil and other tropical regions in South America.","The background of the image shows green foliage, which is typical of the lush, tropical environment found in Brazil.","The overall aesthetic of the image, with its vibrant colors and natural setting, is reminiscent of the diverse and rich",D|G|G,H,0,0.0,3
e8417033-3d23-4eb3-b225-e8d68ff8cde3,internvl2,China,drink,India,"The spices in the image resemble Indian spices, such as star anise and black peppercorns, which are commonly used in Indian cuisine.","The wooden spoon and bowl are indicative of traditional Indian kitchenware, often used in Indian cooking.","The newspaper in the background has text in the Devanagari script, which is used in several Indian languages, including Hindi and Marathi",D|D|E,D|G|H,1,0.3333,3
7469bf5a-e55b-4077-8c23-4f80be8daa32,internvl2,China,drink,Brazil,"The amber color of the liquid in the jar is characteristic of Brazilian honey, which is known for its rich, golden hue.",The jar's design and labeling style are consistent with the packaging commonly used for Brazilian honey products.,"The background elements, such as the kitchen setting and the style of the cabinet, suggest a domestic environment in Brazil, where honey is a popular and widely consumed product.",D|C|G,E|H,0,0.0,3
803df59c-07e6-4459-a5cb-8c2e27237461,internvl2,China,drink,China,The text on the bottle is written in Chinese characters.,"The design and style of the bottle, including the calligraphy, are characteristic of traditional Chinese aesthetics.","The woman's attire, particularly the green collar, is reminiscent of traditional Chinese clothing.",E|E|B,D|E,1,0.3333,3
b2886064-331e-4c71-a625-d9d2c5cd9421,internvl2,China,drink,India,"The flowers in the image resemble the marigold (Tagetes), which is commonly used in Indian culture and is often associated with religious and festive occasions.","The dried flowers have a distinct yellow color, which is characteristic of marigolds, a flower commonly found in India.","The overall appearance of the dried flowers suggests they have been used for traditional purposes, such as in Hindu rituals and",F|G|F,D|H,0,0.0,3
f009866e-207b-4ed4-b0d2-150b69a5d0b0,internvl2,China,food,China,"The architectural style of the building, with its ornate, upturned eaves and intricate details, is characteristic of traditional Chinese architecture.","The presence of Chinese characters on the building, which are used for signage and decoration, is a strong indicator of Chinese influence.","The overall design and layout of the building, including the use of red and gold colors, are commonly associated with Chinese cultural aest",C|E|C,C|E,2,0.6667,3
09c667a0-2ed1-425e-8f15-f0d7b510b5ab,internvl2,China,food,China,The characters in the image are written in Chinese script.,The style of the characters is typical of handwritten Chinese calligraphy.,The use of Chinese characters is a strong indicator of the country of origin.,E|E|E,E,1,0.3333,3
5db4404d-6fd6-4ebd-ad5f-15c8be7344d5,internvl2,China,food,China,"The dish appears to be a type of soup, which is a common dish in Chinese cuisine.","The soup contains what looks like noodles, which are a staple in Chinese cuisine.","The overall presentation and style of the dish, including the bowl and the utensils, are consistent with traditional Chinese dining.",D|D|D,G|H,0,0.0,3
481fa382-ad75-4f6e-bdaa-cdadfbc9f4e5,internvl2,China,food,China,"The map in the image prominently displays China, with its borders and geographical features clearly marked.","The flag of China is displayed in the top right corner of the image, which is a distinct and recognizable symbol of the country.","The text ""China"" is written below the map, further emphasizing the focus on this country.",G|A|G,A|E,1,0.3333,3
a8f5c325-4cc4-4371-bd45-5d19156de028,internvl2,China,food,China,The style of the porcelain teapot and the design of the blue and white pattern are characteristic of traditional Chinese ceramics.,"The floral motifs and the overall aesthetic of the teapot are reminiscent of Chinese art and design, which often features such elements.","The craftsmanship and the specific style of the teapot, including the shape and the glazing, are indic",B|G|D,D|E,1,0.3333,3
96037b83-81d6-4de0-ac58-e2ea3f1d0f68,internvl2,China,rituals,Brazil,"The boats are decorated with vibrant colors and patterns, which is characteristic of Brazilian culture and festivities.","The athletes are wearing red and yellow uniforms, which are the colors of the Brazilian flag.",The presence of the Brazilian flag on the boats and the athletes' attire strongly indicates a Brazilian team.,F|F|H,G,0,0.0,3
22bb7d28-bb29-4a85-af25-85f66ce70d52,internvl2,China,rituals,India,"The structure in the image appears to be a bell, which is commonly found in Indian temples and religious sites.","The bell is attached to a wooden structure with a curved top, which is reminiscent of traditional Indian architectural elements.","The presence of the bell and the structure suggests a religious or cultural context, which is prevalent in Indian culture.",C|C|C,A|E|H,0,0.0,3
4c169dc1-0511-4867-803b-2c5724589072,internvl2,China,rituals,China,"The individuals are wearing traditional Chinese clothing, which includes a blue shirt and a white apron.","The cooking utensils and the method of cooking are indicative of Chinese culinary practices, such as the use of a large, round, flat pan.","The ingredients and the overall setting suggest a traditional Chinese street food or market scene, which is common in many parts of China.",B|D|F,D|H,1,0.3333,3
d6bdefc4-d83f-4df5-a2c0-74ce4bb3dbea,internvl2,China,rituals,China,The text on the red banner is in Chinese characters.,The style of the figurines and the decorations resemble traditional Chinese art and culture.,The overall setting and the style of the decorations suggest a Chinese cultural or festive event.,E|D|F,H,0,0.0,3
aa454b8a-ea44-47d8-bfc5-8e0691affc18,internvl2,China,rituals,China,"The architectural style of the building, with its red walls, green roof tiles, and intricate wooden carvings, is characteristic of traditional Chinese architecture.","The presence of Chinese characters on the building's signage and the decorative elements, which are common in Chinese cultural and historical sites.","The overall layout and design of the courtyard, including the placement of the building and the surrounding greenery,",C|E|C,E|H,1,0.3333,3
c4ba628f-6ccc-4659-88e0-989cf36c6b66,internvl2,Canada,drink,Canada,"The title of the image is ""ALCOHOL SALES IN CANADA.""","The text and data presented throughout the image are specific to Canada, including references to Canadian provinces and statistics about alcohol sales in Canada.","The website at the bottom of the image, www.statcan.gc.ca, is the official Canadian government website, further indicating that the information is about Canada.",D|G|F,A|D|E,1,0.3333,3
c6e2a507-d64e-4f66-a017-8c4bec7a25aa,internvl2,Canada,drink,Germany,"The beer mugs are of the traditional German style, known as ""Mugenbier"" or ""Mugenbiermugen,"" which are typically used for serving beer in Germany.","The beer itself appears to be a lager, which is a type of beer commonly associated with Germany. Lagers are known for their crisp, clean taste and are a staple in German beer culture.",,D|D,D,1,0.3333,2
48cb84ac-f6c8-41d5-a8bd-433790fd4228,internvl2,Canada,drink,USA,"The glassware and the style of the table suggest a modern, Western setting, which is common in the USA.",The design of the milk carton is typical of dairy products found in the USA.,The overall clean and minimalistic presentation is characteristic of contemporary American design.,D|C|C,H,0,0.0,3
af32828e-77c5-4c31-ad76-c68b4c3d2cfb,internvl2,Canada,drink,Turkey,"The presence of a glass of red wine and a glass of white wine, which are commonly consumed in Turkey.","The plate of cheese, which is a staple in Turkish cuisine.","The landscape in the background, which resembles the coastal regions of Turkey.",D|F|G,H,0,0.0,3
96b37654-4373-4743-981d-ef25317c602a,internvl2,Canada,drink,Brazil,"The liquid in the glass appears to be a type of liquor, which is commonly associated with Brazil, particularly the cachaça, a distilled alcoholic beverage made from sugarcane.","The pouring action and the clear glass suggest a casual, possibly outdoor setting, which is typical of Brazil's social culture where cachaça is often enjoyed in a relaxed environment.","The background, though",G|F|G,G|H,1,0.3333,3
a2ebb579-6a95-4ef6-90d3-7472f9739d27,internvl2,Canada,traditions,Brazil,"The man's facial features, including his beard and hair, are characteristic of many Brazilian men.","The style of the child's hair, with its curly texture, is common among Brazilian children.",The overall skin tone of the individuals in the image is consistent with the diverse ethnic makeup found in Brazil.,H|H|H,H,1,0.3333,3
734acb99-0962-4131-b4f7-725c20411db8,internvl2,Canada,traditions,Canada,"The text ""CALGARY STAMPEDE"" indicates that the event is taking place in Calgary, which is a city in Canada.","The presence of the Canadian flag in the logo of ""World Footprints"" suggests that the event is associated with Canada.","The overall theme and setting of the image, including the rodeo and the outdoor show, are typical of Canadian cultural events.",E|A|F,E|H,1,0.3333,3
a914a20e-7219-43e5-929a-a60eeb2b0eba,internvl2,Canada,traditions,USA,The presence of a pickup truck in the background.,The style of the cowboy hat and the saddle.,The style of the pickup truck and the rural setting.,G|B|G,G|H,1,0.3333,3
8869939b-17da-472e-8637-58d80e9291e7,internvl2,Canada,traditions,USA,The design and style of the buttons resemble the buttons found on a typical American keyboard.,"The color scheme of the buttons (silver, red, and yellow) is commonly used in American keyboards.",The layout and arrangement of the buttons are consistent with the design of keyboards used in the United States.,D|D|C,E|H,0,0.0,3
184d6c08-7237-4f6b-b49d-04b5b2bef635,internvl2,Canada,traditions,USA,The presence of the U.S. flag on the monument.,"The uniform of the person standing in the background, which appears to be a U.S. military uniform.","The style of the monument, which is consistent with American war memorials.",A|B|A,A,1,0.3333,3
8a4aa22a-5c51-425d-ad3d-69de43f88b0c,internvl2,Canada,food,Brazil,The green leaf with a prominent vein pattern is characteristic of tropical plants found in Brazil.,"The caterpillar's coloration and the environment suggest a warm, humid climate, which is typical of Brazil's tropical regions.","The presence of a large, green leaf indicates a lush, dense forest habitat, which is common in Brazil's Amazon rainforest.",G|G|G,D|G|H,1,0.3333,3
6c905b2d-0ff6-4c21-b0ef-50861a2cc2b5,internvl2,Canada,food,USA,"The pie crust resembles a traditional American pie crust, which is typically made from a flaky, buttery pastry.","The filling of the pie has a consistency and appearance that is commonly found in American pot pies or savory pies, often containing a mix of meat and vegetables.","The overall presentation of the pie, with its golden-brown crust and hearty filling, is reminiscent of classic",D|H|H,D|H,2,0.6667,3
0c62e0fb-0aea-49a7-b333-b15a64c8359f,internvl2,Canada,food,Turkey,The roasted turkey is a traditional centerpiece of Thanksgiving dinner in the USA.,The corn on the cob is a common side dish served during Thanksgiving in the USA.,"The overall presentation of the meal, including the cornbread stuffing and the variety of vegetables, is typical of a traditional American Thanksgiving feast.",D|F|F,D,1,0.3333,3
7174dc33-dbe6-4c70-a3ef-ae0be8ab6b29,internvl2,Canada,food,USA,"The type of apple shown in the image is a Red Delicious apple, which is a popular variety in the United States.","The apple is depicted in a way that emphasizes its freshness and quality, which is often associated with American agricultural products.","The overall presentation of the apple, with its clean and simple background, is reminiscent of the marketing style commonly used for American produce.",D|D|G,D|H,1,0.3333,3
fdd8ea6d-e848-4b9c-af83-8e1ad010ef1e,internvl2,Canada,food,Brazil,"The bread has a golden-brown crust, which is characteristic of Brazilian breads like Pão de Queijo.","The shape and size of the bread resemble the typical Pão de Queijo, a small, round, and cheese-filled bread.","The texture and color of the bread's interior, with its soft and fluffy appearance, are consistent with Pão de Queijo",D|D|H,H,1,0.3333,3
b5ddf9ce-952d-4fe5-a878-b1ffe90ff1ef,internvl2,Canada,rituals,Iran,"The architecture of the building, with its white color and the presence of a dome, is reminiscent of traditional Iranian mosques.","The palm trees surrounding the building are commonly found in Iran, particularly in regions with a warm climate.","The overall design and layout of the building, including the arched entrance and the symmetrical structure, are characteristic of Iranian architectural styles.",C|G|C,C|G,2,0.6667,3
4f04c1f6-a284-4219-9412-beacc222f51d,internvl2,Canada,rituals,USA,The presence of the American flag in the image.,"The attire of the individuals, which includes suits and formal wear commonly associated with American political or military figures.","The style of the wreath, which is consistent with those used in American military ceremonies.",A|B|F,A|G|H,1,0.3333,3
fa9d08f1-413b-4a05-b058-380843d46806,internvl2,Canada,rituals,USA,The graduation caps (mortarboards) are a common symbol of graduation ceremonies in the United States.,"The academic regalia, including the black gowns and blue sashes, is typical of American graduation attire.","The architecture of the building in the background, with its red roof and white walls, is reminiscent of many American educational institutions.",F|B|C,C|H,1,0.3333,3
746e8569-1091-499b-8de8-08bce681dd84,internvl2,Canada,rituals,Canada,"The man is wearing a red maple leaf pin, which is a symbol of Canada.",The flags in the background are the Canadian flag.,"The man is speaking into a microphone, which is a common activity during political speeches in Canada.",F|A|F,A|F|H,2,0.6667,3
19ae4ab7-a1b1-47c9-a81d-24a4020df41a,internvl2,Canada,rituals,Turkey,"The cross in the image is a prominent feature, which is strongly associated with Turkish culture and history, particularly the Hagia Sophia, a famous landmark in Istanbul, Turkey.","The architectural style of the buildings in the background, with their domes and minarets, is characteristic of Islamic architecture, which is prevalent in Turkey.","The overall layout and design of the image, with its",C|C|G,D|E|H,0,0.0,3
318807ce-d521-41f7-b9b2-e533deb7a178,internvl2,Canada,clothing,USA,"The style of the clothing and accessories, such as the leather bags and jackets, is commonly associated with American fashion.","The design of the store, including the wooden floor and the layout, is reminiscent of many boutique stores found in the United States.","The presence of a variety of high-end and designer items, which are often found in upscale American retail environments.",H|C|H,B|D,0,0.0,3
acd68d0e-9d10-40ef-9fd1-cbdc720808ef,internvl2,Canada,clothing,Canada,"The individual is wearing a red uniform with a distinctive yellow stripe, which is characteristic of a Canadian Parks Canada uniform.","The person is wearing a wide-brimmed hat, which is typical of the Canadian Parks Canada uniform.","The background features a natural, rugged landscape with a body of water and rocky terrain, which is consistent with the natural settings found in Canada.",A|B|G,D|E|H,0,0.0,3
591a4da1-0a04-4dc6-ba4e-a3526dbce1c6,internvl2,Canada,clothing,Canada,"The boots worn in the image are typical of Canadian winter footwear, designed to keep feet warm and dry in snowy conditions.","The snow-covered ground is indicative of a cold climate, which is characteristic of Canadian winters.","The overall attire, including the boots and dark pants, suggests a practical and functional style that is commonly seen in cold climates, such as those found",B|G|D,A|H,0,0.0,3
bfa7333e-1ab0-4ebc-b11c-d7c0cc5a9e8c,internvl2,Canada,clothing,Canada,The prominent maple leaf logo on the jersey is a well-known symbol of Canada.,"The word ""CANADA"" is written across the front of the jersey, indicating the country of origin.","The overall design and color scheme of the jersey, with its red and white colors, are consistent with the national colors of Canada.",G|A|A,A|H,1,0.3333,3
87161e09-edf6-46a7-acf4-1d2ba9f61348,internvl2,Canada,clothing,Canada,"The players on the ice rink are wearing jerseys that are predominantly red and white, which are the colors of the Canadian flag.","The ice rink is a common feature in Canada, and hockey is a popular sport in the country.",The style of the jerseys and the design of the ice rink are consistent with those found in Canadian hockey games.,A|G|C,D|H,0,0.0,3
31824d6c-cdda-43df-9792-17cb3f44217d,internvl2,Nigeria,traditions,Nigeria,"The masks in the image have a distinct style that is commonly associated with traditional Nigerian art and culture, particularly those used in masquerade ceremonies.","The patterns and designs on the masks, including the geometric shapes and the use of specific colors, are characteristic of Nigerian art.","The overall aesthetic and craftsmanship of the masks, along with the style of the baskets and other items in the",B|B|D,E|H,0,0.0,3
7409a04b-e4e0-48a6-83aa-9ea94eeb78da,internvl2,Nigeria,traditions,Brazil,"The snail is on a leaf, which is a common habitat for snails in tropical regions like Brazil.","The leaf has a glossy appearance, which is typical of tropical foliage found in Brazil.",The snail's coloration and pattern are consistent with the types of snails found in Brazilian ecosystems.,G|G|G,H,0,0.0,3
a2ccb005-d747-43f8-8315-2518a1ece07d,internvl2,Nigeria,traditions,Turkey,"The goat in the image has a distinctive appearance, including a black and white face and a brown body, which is characteristic of the Ankara breed of goats commonly found in Turkey.","The goat's horns are curved, which is a common trait among Ankara goats, further supporting the identification of the country.","The environment in the image, with tall grass and a lush green field,",G|G|G,H,0,0.0,3
bb027c12-2666-421b-a523-4bd7c4c30f20,internvl2,Nigeria,traditions,Brazil,"The animal in the image is a capybara, which is native to South America, particularly Brazil.","The background of the image shows lush greenery and a natural environment, which is typical of Brazilian landscapes.","The watermark ""SQUISHIES"" suggests that the image might be from a company or website that deals with exotic animals, which is more common in Brazil due to its diverse",G|G|E,H,0,0.0,3
4713f5b0-48da-4ab5-99bc-ffe12d7d62fa,internvl2,Nigeria,traditions,Nigeria,"The text ""Burkina Faso"" and ""Savannah Rhythms"" suggests a connection to West African music, which is a significant part of Nigerian culture.","The image shows a group of people with dark skin, which is common in West African countries, including Nigeria.",The style of the music and the cultural attire of the people in the image are reminiscent of traditional Nigerian,F|H|B,A|E|H,1,0.3333,3
98b439d0-91bc-40ba-8d77-ec2889c96666,internvl2,Nigeria,clothing,Nigeria,"The hairstyle is a traditional Nigerian braided hairstyle known as ""Gele"" or ""Gele Gele.""","The earring is a large, circular, and ornate piece, which is commonly seen in Nigerian fashion.","The makeup style, particularly the defined eyebrows and the use of eyeliner, is reminiscent of Nigerian beauty trends.",B|B|H,H,1,0.3333,3
4457fdf9-a623-41bd-8a0d-fd42128f38b3,internvl2,Nigeria,clothing,Nigeria,"The attire of the individuals in the image is reminiscent of traditional Nigerian clothing, particularly the Ankara fabric, which is widely used in Nigerian fashion.","The vibrant colors and patterns seen in the dresses are characteristic of Nigerian textile designs, which often feature bold and bright colors.","The hairstyles of the individuals, such as the beaded hair accessory and the natural, voluminous hairstyles",B|B|H,B|H,2,0.6667,3
2c1bd295-9cde-47af-af0e-202c03272d01,internvl2,Nigeria,clothing,Nigeria,"The headwrap worn by the models is known as a ""gele,"" which is a traditional Nigerian headwrap.",The vibrant and colorful patterns on the swimsuits are reminiscent of traditional Nigerian textiles and designs.,"The overall style and presentation of the models, including their makeup and accessories, are consistent with Nigerian fashion trends.",B|B|H,B|H,2,0.6667,3
da343301-2fc3-42b9-9d8e-7f90b000f00f,internvl2,Nigeria,clothing,Ethiopia,"The attire of the women, specifically the headscarf and the patterned dress, is indicative of traditional Ethiopian clothing.","The landscape and the type of vegetation, which appears to be coffee plants, are consistent with the coffee farming regions in Ethiopia.",The overall rural setting and the method of harvesting the crops are typical of agricultural practices in Ethiopia.,B|G|G,B|G,2,0.6667,3
c717f3a6-7b14-4f61-b395-89d63b0c6e73,internvl2,Nigeria,clothing,Nigeria,"The attire of the individuals, which includes vibrant, colorful garments with intricate patterns, is characteristic of traditional Nigerian clothing, such as the Ankara fabric.","The headwrap worn by the woman on the right is a Gele, a traditional Nigerian headwrap, often worn by women in Nigeria.","The overall style and presentation of the individuals, including their confident poses and the way they are",B|B|H,E|H,1,0.3333,3
4b6b43e4-d3c9-4faf-8ed9-ed1e51754baf,internvl2,Nigeria,rituals,China,"The plant in the image appears to be a type of mustard, which is commonly grown in China and used in various traditional dishes.","The soil and the way the plant is growing suggest a temperate climate, which is typical of many regions in China.",The overall appearance of the plant and the soil conditions are consistent with agricultural practices commonly found in China.,G|G|G,D|G,1,0.3333,3
6e72fc43-14d2-40a5-863c-62d14dc5facb,internvl2,Nigeria,rituals,Nigeria,"The attire of the individuals, particularly the vibrant and colorful traditional clothing, is indicative of Nigerian cultural attire, such as the Ankara fabric often worn in Nigeria.","The headwraps worn by the women are also characteristic of Nigerian traditional attire, known as Gele, which is commonly worn in Nigeria.","The communal and celebratory nature of the gathering, with people dancing and",B|B|F,B,1,0.3333,3
60c2f1e2-820c-4c10-a873-af1a75d9e4db,internvl2,Nigeria,rituals,Nigeria,"The attire of the individuals, particularly the headwraps, is indicative of traditional Nigerian clothing.",The presence of palm trees in the background is a common feature in many parts of Nigeria.,"The overall atmosphere and the style of the event suggest a cultural or traditional celebration, which is common in Nigerian festivities.",B|G|F,B,1,0.3333,3
