question,u_id,facet,country,all_answers
"From 1920 to 1960, in which city were the clothes shown in the picture most popular among the upper class?",1309b373-b885-4aa0-b6f8-7aab4b734ac2,clothing,China,['Shanghai/shang hai']
What is the animal depicted in the picture?,49f5b3aa-dc13-4ebe-bf8d-6771b9298c37,traditions,China,['Chinese dragon' 'Lion' 'lion']
On what festival people will do the activity shown in the picture?,502a5fee-89c1-4f5d-b41d-9bdd65b11eb1,traditions,China,['Spring festival' 'Spring Festival' 'Spring Festival']
"During the Spring Festival, where do people typically stick the item depicted in the image?",08f8c99f-b47b-46f6-8e29-6bcaa11d8ab1,traditions,China,['Window/On the window']
Whose picture is in the center of the building shown in the picture?,1bad08e1-1e74-421f-996f-5c435cb367e3,traditions,China,['Mao Zedong' 'Zedong Mao' 'Tiananmen']
What is the item in the person's hand?,de8ac0fa-d6dc-41bb-b117-f5e84f22e9e5,traditions,China,"['red envolop' 'Red Envelope' 'red packet'
 'red envelope/red packet/hongbao/hong bao']"
What is the flower shown in the picture?,07dabc78-3e60-46e1-b6e4-14c03b083f61,drink,China,['lan' 'Camellia' '' 'Jasmine flower/Jasmine']
What is the egg shown in the picture soaked in?,e8417033-3d23-4eb3-b225-e8d68ff8cde3,drink,China,['tea' 'Tea eggs' 'tea' 'Tea']
"If you soak the item in the picture in water to drink, when is it usually consumed?",7469bf5a-e55b-4077-8c23-4f80be8daa32,drink,China,['Morning/In the morning']
What is shown in the picture?,803df59c-07e6-4459-a5cb-8c2e27237461,drink,China,['white wine' 'Baijiu' 'Baijiu' 'Baijiu/white wine/white liquor']
What is the thing shown in the picture?,b2886064-331e-4c71-a625-d9d2c5cd9421,drink,China,['chrysanthemum' 'chrysanthemum' 'Chrysanthemum tea']
What is the structure at the corners of the roof of the building in the picture called?,f009866e-207b-4ed4-b0d2-150b69a5d0b0,food,China,['roof ridge' 'Fei Yan' 'Yijiao' 'Fei Yan/Flying Cornice']
How many strokes are there in the character shown in the picture?,09c667a0-2ed1-425e-8f15-f0d7b510b5ab,food,China,['Thirteen']
Which type of fish does the food shown in the picture come from?,5db4404d-6fd6-4ebd-ad5f-15c8be7344d5,food,China,['' 'shark' 'Shark']
What is the main political party shown in the picture?,481fa382-ad75-4f6e-bdaa-cdadfbc9f4e5,food,China,"['Chinese communist party' 'Communist Party of China'
 'Communist Party of China']"
What style of pottery is shown in the image?,a8f5c325-4cc4-4371-bd45-5d19156de028,food,China,"['blue porcelain' 'Blue and white porcelain'
 'Blue and white pottery/Qing Hua Ci/Qinghuaci']"
In what festival will people do this activity shown in this picture?,96037b83-81d6-4de0-ac58-e2ea3f1d0f68,rituals,China,['Dragon Boat festival' 'Dragon Boat Festival' 'Dragon Boat Festival']
"In ancient east Asia, on which part of the day will people use the item in the picture?",22bb7d28-bb29-4a85-af25-85f66ce70d52,rituals,China,['Morning/In the morning']
What are the people in the picture doing?,4c169dc1-0511-4867-803b-2c5724589072,rituals,China,['rolling the tea' 'drying the tea']
What is the animal figure in the very front of the picture?,d6bdefc4-d83f-4df5-a2c0-74ce4bb3dbea,rituals,China,['Lion' 'Loong']
What is the religion of the building in the picture?,aa454b8a-ea44-47d8-bfc5-8e0691affc18,rituals,China,['Taoism' 'Qing' 'Buddhism or Taoism']
"Based on the pictured map, which province spends the most on liquor per person?",c4ba628f-6ccc-4659-88e0-989cf36c6b66,drink,Canada,['Yukon']
What percentage of the beverage pictured is consumed and also produced in Canada?,c6e2a507-d64e-4f66-a017-8c4bec7a25aa,drink,Canada,['50%' '100' '20' '50' '30']
What has to be added to the pictured beverage in Canada?,48cb84ac-f6c8-41d5-a8bd-433790fd4228,drink,Canada,['Vodka' 'milk' 'vitamin A and D' 'chocolate' 'Vitamin D']
What is this alcoholic beverage that famously is made in Canada's Okanagan valley?,af32828e-77c5-4c31-ad76-c68b4c3d2cfb,drink,Canada,['Apple cider' 'wine' 'wine' 'wine' 'wine']
What is another name for the liquid being poured here?,96b37654-4373-4743-981d-ef25317c602a,drink,Canada,['Whiskey' 'maple syrup' 'whiskey' 'rum' 'Rye']
What day is the day that celebrates dads in Canada?,a2ebb579-6a95-4ef6-90d3-7472f9739d27,traditions,Canada,"[""Father's day"" ""Father's day"" 'Fathers Day' 'Fathers day' ""father's day""]"
What is considered the greatest outdoor show in Canada,734acb99-0962-4131-b4f7-725c20411db8,traditions,Canada,"['Calgary Stampede' 'calgary stampede' 'Calgary Stampede'
 'Calgary stampede' 'calgary stampede']"
What is the name of the outdoor show you might see these animals walking on the streets?,a914a20e-7219-43e5-929a-a60eeb2b0eba,traditions,Canada,"['Calgary Stampede' 'Calgary Stampede' 'calgary stampede' 'parade'
 'calgary stampede']"
Where are the headquarters of the sport shown here located?,8869939b-17da-472e-8637-58d80e9291e7,traditions,Canada,"['Scotland' 'Canada' 'Ottawa' 'Orleans, Ontario' 'Ontario']"
What is the famous landmark shown in the image?,184d6c08-7237-4f6b-b49d-04b5b2bef635,traditions,Canada,"['Tomb of the unknown soldier' 'tomb of the unknown soldier'
 'Tomb of the Unknown Soldier' 'Tomb of the unknown soldier'
 'remembrance day']"
Where could you find where these creatures live?,8a4aa22a-5c51-425d-ad3d-69de43f88b0c,food,Canada,['Garden' 'library' 'forest' 'forest' 'google']
From which province did this desert come from?,6c905b2d-0ff6-4c21-b0ef-50861a2cc2b5,food,Canada,['British Columbia' 'ontario' 'Quebec' 'quebec' 'Ontario']
Which meat shown is enjoyed by many in Canada during the month of October?,0c62e0fb-0aea-49a7-b333-b15a64c8359f,food,Canada,['Thanksgiving' 'turkey' 'turkey' 'turkey' 'turkey']
What is this fruit that is harvested in autumn in Canada and used in desserts such as pie?,7174dc33-dbe6-4c70-a3ef-ae0be8ab6b29,food,Canada,['Apple' 'apple' 'Apple' 'apple' 'apple']
Which type of the food shown is popular in the prairies at wedding socials?,fdd8ea6d-e848-4b9c-af83-8e1ad010ef1e,food,Canada,['bread' 'Raisin bread' 'bread' 'rye' 'raisin bread']
What kind of religious structure is depicted,b5ddf9ce-952d-4fe5-a878-b1ffe90ff1ef,rituals,Canada,['Church' 'mosque' 'temple' 'church' 'temple']
What is the item shown that is laid down on November 11th?,4f04c1f6-a284-4219-9412-beacc222f51d,rituals,Canada,['Wreath' 'wreath' 'wreath' 'reef' 'wreath']
What university ceremony is depicted,fa9d08f1-413b-4a05-b058-380843d46806,rituals,Canada,['Graduation' 'graduation' 'graduation' 'graduation' 'convocation']
Where do many canadians go the night before the pictured holiday?,746e8569-1091-499b-8de8-08bce681dd84,rituals,Canada,"['Church' ""family's house"" 'church' 'church' 'sleep']"
What religious symbol shown in the picture is commonly seen in Canada?,19ae4ab7-a1b1-47c9-a81d-24a4020df41a,rituals,Canada,['Cross' 'church' 'cross' 'cross']
what Canadian retail company specializes in leather products,318807ce-d521-41f7-b9b2-e533deb7a178,clothing,Canada,"['Roots' ""hudson's bay"" 'Danier' 'Danier' 'canada leather']"
What iconic piece of fashion is being worn by the mounted police officer?,acd68d0e-9d10-40ef-9fd1-cbdc720808ef,clothing,Canada,['Mountie Hat' 'hat' 'red coat' 'hat' 'hat']
What geological structure can these shoes be worn to walk upon?,591a4da1-0a04-4dc6-ba4e-a3526dbce1c6,clothing,Canada,['Mountains' 'ice' 'rocks' 'snow' 'snow']
In what year did this team break a 50 year gold medal drought by winning this olympic event?,bfa7333e-1ab0-4ebc-b11c-d7c0cc5a9e8c,clothing,Canada,['2002' '1900' '2002' '200' '2010']
"Who is a plaid suit wearing, white-haired man that was previously the voice of this sport on tv?",87161e09-edf6-46a7-acf4-1d2ba9f61348,clothing,Canada,['Don Cherry']
What traditional name is given to the motifs on the objects in the image?,31824d6c-cdda-43df-9792-17cb3f44217d,traditions,Nigeria,['Leather Pouf' 'Adinkra' '' '' 'Design']
What is the figure called by the Yorùbá people of Nigeria?,7409a04b-e4e0-48a6-83aa-9ea94eeb78da,traditions,Nigeria,"['The figure is called ""Ìgbín"".']"
What is this figure called by the Yoruba people of West Africa?,a2ccb005-d747-43f8-8315-2518a1ece07d,traditions,Nigeria,"['Ewure' 'Agbo' 'Ewúrẹ́' 'Ewúrẹ́' '' 'It is called ""Ewúrẹ́""']"
A person who shares same name with the animal in the image is known for what?,bb027c12-2666-421b-a523-4bd7c4c30f20,traditions,Nigeria,"['Dirtiness, filthiness'
 ""Kingship in Igbo culture. Fertility in Yoruba's culture""
 'Being ruthless' 'dirty' 'being dirty']"
"In cultural events, only good _____ can set off the kind of mood set off in the picture above.",4713f5b0-48da-4ab5-99bc-ffe12d7d62fa,traditions,Nigeria,['Music']
What is the Nigerian name for the hairstyle in the image?,98b439d0-91bc-40ba-8d77-ec2889c96666,clothing,Nigeria,['Ghana weaving' 'Ghana weaving' 'Ghana weaving' 'braids' 'Braiding']
The cultural concept shown in the picture above us called _____ in Yorùbá.,4457fdf9-a623-41bd-8a0d-fd42128f38b3,clothing,Nigeria,['aso ake' '' 'Àdìrẹ' 'ankara style' 'Fashion parade' 'Ankara']
What is the Nigerian market name for the cloths worn by the figures in the image?,2c1bd295-9cde-47af-af0e-202c03272d01,clothing,Nigeria,['' '' 'Bikini' 'ankara' 'Nigerian wax']
What is the raw material for the carrier on the back of the woman in the image?,da343301-2fc3-42b9-9d8e-7f90b000f00f,clothing,Nigeria,['Raffia palm']
The cloth in this image is originated from Ashanti Kingdom in Ghana and is called?,c717f3a6-7b14-4f61-b395-89d63b0c6e73,clothing,Nigeria,['Kente' 'Kente' 'Kente' 'ankara' 'Kente' 'Kente cloth']
What lesson do parents used the item in the image to convey to their kids during story time?,4b6b43e4-d3c9-4faf-8ed9-ed1e51754baf,rituals,Nigeria,['Diligence' 'Perseverance' '' 'To be fast']
What is the function of the bells held by the figures in the figure?,6e72fc43-14d2-40a5-863c-62d14dc5facb,rituals,Nigeria,"['Attention-catching' 'To make a sound.' 'To make musical sounds' 'Music'
 '' 'It is to invoke the spirit of Ouidah.']"
What are the figure in the image performing?,60c2f1e2-820c-4c10-a873-af1a75d9e4db,rituals,Nigeria,"['Singing' ""Image didn't load"" 'Dance' 'Sẹkẹrẹ dance' 'Dancing']"
Why that posture for initiation?,0ce7d616-31bd-4eac-99ec-195e0172b4fc,rituals,Nigeria,['The posture symbolize total submission readily to receive blessing']
This image depict what in Haiti?,3a181f33-846c-43f8-8512-5919ce7088bf,rituals,Nigeria,['Voodoo flag' '' 'Embroidery' '' 'Haitian Vodou and homosexuality']
What item is questioned in an Igbo proverb as to how it entered the pipe of the fruit in the image?,67fa11a3-fa1f-4817-a189-87f38daf3011,drink,Nigeria,['Water']
"In northern Nigeria, what is usually the content of the object carried on the head of the figure in the image?",6518121e-ba08-4e76-aa33-2c2e00598fdd,drink,Nigeria,['Fura de nunu (cow milk)']
What does this little child hold in the image?,dc012abe-5e86-41c4-b740-a9e91a0fe240,drink,Nigeria,['A cup']
The item being held in the picture above is,3b78bd2d-5f55-4480-8637-ccc22c549402,drink,Nigeria,"['juice, drink' 'Five alive' 'Fanta drink' 'Orange juice' 'juice']"
"In the southeastern part of Nigeria, what is usually the content of the gourd in the image?",9ace2f1e-6a06-45ba-bed9-46ac3b80b038,drink,Nigeria,['Palm wine']
Which states in Nigeria are the fruit in the above image grown in?,ecd4f0c8-0bb6-4a35-ac36-66588d7d4185,food,Nigeria,['All the states']
In what form is the snack in the image above sold as street food in Nigeria?,69a710fd-f216-43b8-9ec6-8fd324c49690,food,Nigeria,"['ball' 'Boiled' 'Boiled/Baked' 'Groundnut soup'
 'Kuli-kuli, roasted, cooked' 'Boiled or roasted']"
What is the name of the tree in the picture displayed?,30beeebf-ea67-484f-93a7-2cfd29242fe4,food,Nigeria,['Baobab tree']
"What vegetables are commonly used in making this type of meal, as shown in the image?",6edf17b0-f94a-42d4-b233-4234439deda4,food,Nigeria,"['carrot, onions, Peas, Bell Peppers and Corn']"
Mention 3 ingredients to prepare Efo riro,c6582a96-d4df-4b5a-8a86-3652687aa1e8,food,Nigeria,"['Leafy greens, (efo); peanut; and locust beans, (iru).'
 'Vegetable, oil and pepper' 'Vegetable, rodo (pepper), palm oil'
 'Waterleaf, fish and yam.' 'Spinach, iru, crayfish']"
"What popular American breakfast dish is known for being thick, stodgy, and often served with sweet toppings as part of a larger breakfast spread?",13f37320-7bb5-4232-9bf2-8f28c57c4582,food,USA,['Pancakes']
What is a famous cultural flatbread created with one of the objects in the image?,9e63b44b-6f24-4288-9b27-8626e11bf0a3,food,USA,['Tortillas' 'tortilla' 'tortilla' 'Corn Bread' 'tortilla' 'Tortillas']
What kind of room is this?,a2dcde1c-1b2c-4936-ac07-8e912413e23e,food,USA,['Kitchen.']
What state is this university located in?,6f5bf0aa-f72d-4e5d-8ac8-bcc1761d0f8a,food,USA,['Indiana.']
Where is this food popular?,41388d0a-c0cd-4947-a415-db9ba4893bcd,food,USA,['South.']
What holiday are these popular for?,4455c508-07a5-483c-a247-92904d635fee,traditions,USA,['Halloween.']
What holiday is represented here?,9e592190-7413-4778-8631-3908e7577661,traditions,USA,['Christmas' 'Christmas' 'Christmas' 'Christmas' 'Christmas']
"What animal is symbolic of American culture, particularly associated with its historical significance and contributions to western societies?",a6b53f36-7864-4876-a058-7e0be321388b,traditions,USA,['Horses']
What is the name of this superhero?,5473783d-ba57-45b2-8414-33eb26c36ccf,traditions,USA,['Superman.']
What historical event is Thanksgiving commonly associated with?,89df03ce-b19f-474d-8f36-e9b41be7d3d5,traditions,USA,"['Pilgrims' 'Discovering America supposedly' 'feast with Indians'
 'The pilgrims and indians sharing a meal' 'Pilgrims and indians meeting'
 'Which group helped the Pilgrims during the First Thanksgiving']"
Why would this scare some people?,7d6f190c-4df7-4306-a1e9-b87ed1e3087c,rituals,USA,"['ghostlike' 'racism' 'Looks like ghosts' 'it is about the Korean War'
 'Zombies']"
What hand would you normally wear a wedding ring in the US?,ff57c370-a704-49a2-8662-f040dca197df,rituals,USA,['Left.']
What military branch is reflected here?,87a16f79-2e21-4b11-93b2-4871169911e7,rituals,USA,['Navy.']
Who is this person?,1880497c-e945-4689-839e-03022a70d7a7,rituals,USA,"['George Washington' 'George Washington' 'George Washington'
 'George Washington' 'George Washington']"
What is represented here?,4436f0b0-f4fe-4383-911d-4640c75d9018,rituals,USA,['Different religions.']
What kind of weather would the man wear this in?,46718728-a72a-4651-a2dc-d9d39b32ab74,clothing,USA,['Winter.']
"What type of clothing is depicted in the image, known for being handcrafted in the USA with a focus on superior craftsmanship and sustainability?",87cc957e-bd81-4ea9-8d40-d6d9bce4ec76,clothing,USA,['Handcrafted dresses']
Why are the clothes on hanging?,2b697bc6-809b-4d92-aa10-10c31472acaa,clothing,USA,['display' 'drying off' 'To decorate wall' 'line' 'Drying']
Why is there a star at Lome?,f3dee24e-9af4-4a3e-b21c-ad8bf74510dc,clothing,USA,['That is a capitol city.']
What is usually done with these pieces of fabric?,b6aaf31f-d668-4f6e-9d34-c7ecbfa7c8a8,clothing,USA,['they are sewn onto other garments.']
What temperature are these drinks?,9f2b9f74-faa4-4b54-a4f1-aa65e32cb9f9,drink,USA,['Cold.']
What are the bubbles at the top called?,7cd63749-44d8-4024-ac6c-727bde0ae91a,drink,USA,['The head.']
What is the tube made out of?,dca004c5-3d95-44e6-95ef-8116165e04a3,drink,USA,['money' 'dollar bill' 'Money' 'Money' 'banknote']
People that drink this have to be what age?,d527b146-00a1-41fb-8671-6114ee9cabb9,drink,USA,['21 or older.']
What classic American treat is often paired with a burger and fries to create a quintessential American meal,2fd3e1c4-4980-4f7d-8876-69cd79654a75,drink,USA,['milk shake' 'milkshake' 'Milk Shake' 'Milkshake' 'milkshake' 'Milkshake']
Which country does the above location belong?,41e6fcd3-a802-4639-a9f3-3943c6b1242a,rituals,India,['Nepal']
Where does the bride go after the type of marriage shown above?,6a8d47c3-55db-4f2d-b7e0-6c25b6a268c8,rituals,India,"[""Groom's house""]"
What Festival Do These People Celebrates?,b577985c-6eca-41d4-805c-13fdb8822df8,rituals,India,"['ganga-aarti' 'Ram Navami' 'Ganga aarathi' 'Ganga-Aarti' 'Diwali'
 'They People Celebrates Are Ganga Aarathi.']"
Which animal is worshipped for giving us the above substance?,fdc20e45-b3db-48bd-946b-8969194f3fde,rituals,India,['Cow']
Can you guess which religion most people in the image belong to?,9844e1be-1620-44ee-ac68-57ae9d58ab4f,rituals,India,['Hindu']
Which dress are these women wearing?,eced265e-c274-45b9-9e1d-16ab6fbad9cd,clothing,India,['Sari' 'Saree' 'Saree' 'Saree' 'Saree' 'Saree']
In which country this kind of dress is worn?,a9aa210b-bfa3-4ff6-8c82-3c3e7b4544b5,clothing,India,['India' 'India' 'India' 'India' 'India']
What is the flower working made of?,0c06402c-32eb-4fb0-bd5c-3d8ce5f6e9e2,clothing,India,['Embroidery' 'Embroidery' 'Rose' 'Zari' 'Embroidery']
What is the fabric on the side called?,ac9a3d5c-63dd-4fbd-9676-9f913f4029f3,clothing,India,['Dupatta']
What kind of Indian dress does lady wearing in the image?,520f8c8b-3426-4a8e-affd-07b0c26f954b,clothing,India,['Saree']
What is white thing seen on the mountain?,d4d631c2-4c15-4f43-b3bb-bd1fe3157b64,traditions,India,['It is full of snow']
What location is shown above?,0f7abdc3-c885-4d91-bb7d-67f1c607a7d0,traditions,India,['Manikaran']
To which country does the flag belong to?,be330458-bfe8-4b6d-ab4f-0e121faca59d,traditions,India,['India']
Which Hindu sect hails from the above region?,ae89905e-966f-43f0-8c0f-cc4ce1b87ac1,traditions,India,['Kashmiri Pandits']
What is the name of Onan shown in the above picture?,3156bba1-7c6d-417e-8841-d6319dc7e3af,traditions,India,"['onan' 'Plumed basilisk' 'Chinese water dragon' 'Chinese Water Dragons'
 'The name of the person shown in the picture is Onam. It is a culturally significant harvest festival celebrated in the Indian state of Kerala.'
 'Chinese water dragon']"
What other spice is added usually to the above drink but not shown above?,dad09341-9891-4f9e-b292-1f834f9fedc4,drink,India,['Cardamom']
What beverage is made when milk is boiled with the above substance?,9e192054-6b30-44b3-841f-785853bfe7e4,drink,India,['Chai']
What is the spice shown above that is added to the beverage?,4048bef4-586f-466a-8f53-3a1332979fcd,drink,India,['Anise']
What type of drink is shown above,c62249de-cc8b-43b7-aa90-842dbd8d89e2,drink,India,['Darjeeling Tea']
In which city is the above building?,6ec6b59a-9126-4462-89ee-df55d996f4ab,drink,India,['Mysore']
In which country this type of sweets consumed?,5c7b7038-b58d-4a21-b867-b7a72612ff55,food,India,['India']
What is the animal in the image depicts?,39e397ed-fa8c-40ee-974d-b2f01e397e64,food,India,['Garuda']
What is the popular dish made from the above?,a82f3319-8037-44df-bcab-0d39d14590e6,food,India,['Baingan ka Bartha']
What kind of drawing is seen in the background image?,3bbeaac4-39d5-449f-b8e0-69a66bbb9400,food,India,['Flower' 'Mandala' 'Mandala' 'Rangoli' 'Mandala wall tapestry']
What root is shown above?,4e2b3e11-9de8-4bfb-99c2-0bac3f7c7618,food,India,['Ashwagandha']
What is the man preparing?,e43999fc-df28-41f1-982f-64a51d79acb7,rituals,Turkey,"['He is preparing a kese, which is used in Turkish bath for cleaning.']"
In which occasion does the woman put salt in the hot beverage depicted in the item?,c3a1ddb5-f12f-4806-bda6-4189d38228d7,rituals,Turkey,"[""Asking for the girl's hand in marriage\r\rAsk for blessing""]"
What is the given building inside the image?,a950d18e-1dbc-46c8-955e-4bbf4f41aadb,rituals,Turkey,['mosque' 'Mosque' 'Camii->mosque' 'Mosque']
"What is the name of event that mother-in-law, bride and other relatives do the activity depicted in the image?",2b049977-6bfc-4a19-b59a-c9e2beffab94,rituals,Turkey,['Bridal Bath']
What is given inside the image?,2329409d-2712-4aa5-96d1-2cd16298f150,rituals,Turkey,['Oud' 'Bağlama' 'Ud' 'Ney']
What is the served beverage in image?,a7465e78-a57b-4a6c-bbcf-9214feeafb74,drink,Turkey,"['Türk kahvesi->Turkish coffee' 'Turkish coffee' 'Lipto ln'
 'Turkish coffee']"
What is the beverage given inside the image?,fc76de15-b866-4251-af12-bd76901f7c3d,drink,Turkey,['Tea' 'Tea' 'Turkish tea' 'Çay->Tea']
What is the name of utensil depicted in the image?,cedc6039-0f3d-4995-bf1f-eb1cd6590cbf,drink,Turkey,['Cezve' 'cezve' 'Tea cup' 'Cezve']
How many parts does the preparation tool to brew the hot beverage depicted in the image have?,1a2b2bda-ede8-4e7c-99a6-7072401066e6,drink,Turkey,['2']
What is the beverage given inside the image?,fa819613-c07e-4e81-ae2a-6a5fee7b350b,drink,Turkey,"['Turkish Cafee' 'Turkish coffee' 'turkish coffee'
 'Türk kahvesi->Turkish coffee']"
Where do you wear the cloth depicted in image?,4efc5850-d150-471b-8188-4f35d3b63b48,clothing,Turkey,['Hamam->Turkish bath' 'hamam' 'Bathroom' 'Shower']
What is given inside the image?,a5ffd0e5-343e-484b-92dc-aa8f00b18e98,clothing,Turkey,['Peştemal' 'pestemal' 'Towel' 'Towel']
What is the woman wearing?,c67a3887-7cf3-4455-8122-e60eedd643a7,clothing,Turkey,['Bindallı' 'Bindalli' 'Gown' 'Bridal dress']
Where do you wear the type of clothings depicted in the image?,0c5aee4c-d9fe-462e-8df1-ef7320c618cb,clothing,Turkey,['Hamam->Turkish bath' 'bathroom' 'hamam' 'Bath']
What do you wear against the item depicted in Turkey?,2272ab97-94b6-4151-9ec6-763f05b0c22c,clothing,Turkey,['Nazar']
What is the prepared dish called?,2b514973-2195-4908-8bda-3f958deb8bdb,food,Turkey,['Barbunya' 'Borlotti Cranberry' 'Barbunya' 'Bean']
Which region of Turkey is the leading producer of the plant depicted in the image?,f7a3dcee-b9cb-4f4b-94b6-617336a4d320,food,Turkey,['Ordu' 'Bursa' 'black sea' 'mediterranean']
What is the most famous Turkish sweet with pistachio or hazelnut depicted in the image?,fd72fc17-d0df-47fd-9d0c-4e6803e873c0,food,Turkey,['Baklava' 'Baklava' 'Baklava' 'Baklava']
What other filling is used for the preparation of the items in the image?,e3ddb612-2a9b-4cda-a547-572583a1e202,food,Turkey,['walnuts' 'Ceviz->walnut' 'baklava' 'walnut']
Is this ice cream easy to melt?,c6f9ae05-ef81-4957-b6f0-7a177580e2d5,food,Turkey,['No']
What is the man's occupation?,443e4b25-3d4a-40e3-a270-e48c9d37f105,traditions,Turkey,['Horse groomer' 'groom (seyis in Turkish)' 'seyis' 'Seyis->horse breeder']
How many years will the item depicted in the image be remembered as said in Turkish proverb?,e2af3f45-8230-49e5-9fb2-19c8b42b9816,traditions,Turkey,['40 years' '40' '40' '40']
In which city of Turkey can you find the house depicted in the image?,9463f29a-4672-4021-923f-3827ddcfae45,traditions,Turkey,['Trabzon' 'Trabzon' 'Muğla' 'Antalya']
What are the given objects inside the image?,c5fa60a8-7191-498a-8cc9-db07ec48dd86,traditions,Turkey,"['' 'Ok, yay->arrow, bow' 'Pen' 'Arrow']"
What is the name of the region displayed in the supplied picture?,a48d89f9-3486-46e8-a68c-c47ad537226f,traditions,Turkey,"['Central Anatolia' 'Cappadocia' 'Kapadokya->Cappadocia'
 'Central Anatolia' 'Cappadocia']"
During Which Holiday is the item in image most commonly eaten?,468a0a50-3eba-40b2-92b0-5b172fb30c01,traditions,Ethiopia,"['Ethiopian Easter (Fasika)' 'Ester' 'New Year, Christmas, Easter']"
which Theatre building shown in the image is the oldest in Ethiopia?,f555701d-40c7-4400-9bdc-eda62ace2912,traditions,Ethiopia,['Hager fkr theatr' 'Hager Fikr theatre']
What is the purpose of the object she is holding in her hand as shown in the image?,6653f8dd-3fff-48a3-8e29-065917a610b0,traditions,Ethiopia,['Fetch water' 'Carry and store water' 'To carry and store water']
What is the name of the Ethiopian place where the depicted image originated?,8eafe537-95b2-4e1f-8416-8196d5fd59cb,traditions,Ethiopia,['Jimma' 'Keffa']
"what is the cultural saying, which a stranger says to get Ethiopians hospitality as shown in the picture?",7cde7484-09d6-4675-859f-c98293b98f27,traditions,Ethiopia,"['""Yemeshebet Mengedegna""']"
what is the drink that the lady in the picture is serving?,b42f7e81-16d7-4b6b-a305-d8e79c5ddf58,drink,Ethiopia,['Coffee' 'buna' 'Coffee']
What is the name of ethiopian city where the depicted image originated?,46f8812b-adca-4161-ae1f-9f6c5600599c,drink,Ethiopia,['Sidama' 'Kaffa' 'Keffa']
what king of cup is used for serving the drink in the image?,d97dd49b-2351-46fb-814b-b5f0a72d251e,drink,Ethiopia,['birilay' 'Birilee']
in which kind of places in Ethiopia does the artifact in the figure mostly hang?,c8b19f46-371b-46f5-89ca-93b99b2fd6a0,drink,Ethiopia,['Coffee house' 'Ethiopian coffe house' 'wall']
What is the name of the Kenyan city where the depicted image originated?,f71472c0-2cb4-475d-9b08-5787585f550e,drink,Ethiopia,['Nirobi' 'Nairobi' 'Nairobi']
which police wear the blue ranger uniform shown in the figure?,bff5977b-7901-4d1e-96a1-5c0d19848a0f,clothing,Ethiopia,['Ethiopian fedaral police' 'Ethiopian federal police']
What is the local name of this collection of cloths as shown in the image in Ethiopia?,5880280d-93fc-446b-8079-58300559adda,clothing,Ethiopia,['Bonda' 'Bonda' 'salbaj or bonda']
on what clothes do we see designs shown in the image?,9cddc74e-a74b-4b29-9493-f6bac0aa27ea,clothing,Ethiopia,['Amhara cultural female clothes' 'Amharan cultural Female clothes' 'gabi']
Which group is represented by the dressing style that the man is wearing?,0b04f451-42cf-462b-b983-307e13183f45,clothing,Ethiopia,['Orthodox priest' 'Ethiopian Priests']
What is the main common use does the item in the figure have?,01a1d08a-e2a5-4a81-afb5-9831cddd3e88,clothing,Ethiopia,['Making cotton' 'Medicine']
Which kind of crop is gathered in the sytem shown in the image?,3d4755c8-3116-45b7-a80f-10c886ec742d,food,Ethiopia,['Teff' 'Teff']
"in which city in Ethiopia does the plant's fruit shown in the figure, be prepared and eaten?",1b7870bb-8b83-46e9-bced-5f1f7c45ec19,food,Ethiopia,['Dire Dawa']
What is the main ingredient use to prepare the item shown in the figure?,9c96c4f7-b755-4960-948b-8c0ea7761880,food,Ethiopia,['Teff' 'Teff' 'Teff']
